date,program,link,transcript
2015-06-27,Rape conviction rates have fallen to 56.9%.,https://web.archive.org/https://web.archive.org//web/20150627071105/http://news.sky.com/story/1508311/why-we-should-celebrate-rape-conviction-rates,"Rape conviction rates have fallen to 56.9%. As always, there is a world hidden beneath that simple statistic. The difficult decision to go to the police. Swabs taken, clothes tested. Reliving the attack numerous times – in the police interview room, in the court. Waiting for the verdict, to find the perpetrator has been found not guilty. Campaigners will be – rightly – concerned by the Crown Prosecution Service figures for 2014/15. Low conviction rates for rape, a crime notoriously difficult to prove, are a big worry for women's rights activists and the authorities should be held to account. Katie Russell of Rape Crisis said: ""The report highlights that we still have some distance to travel before all survivors of sexual violence and violence against women and girls receive the justice they want and deserve and there is no room for complacency."" But, sometimes, it’s also right to celebrate how far we have come. The conviction rate for rape may be falling, but more people are being found guilty than ever before. More cases are being brought to the courts in the first place – a total of 2,581. Alison Saunders, the Director of Public Prosecutions, said the report was testament ""to the hard work we have done recently to encourage victims to come forward, to work better with the police and ensure specially trained prosecutors bring the right cases to court."" In total, some 107,104 cases concerning violence against women and girls were prosecuted during the timeframe, a rise of 18.3% on the previous year. The number of those convicted rose to its highest level at 78,773 - up 16.9% on the previous year. It's great news that victims are being taken seriously and more rape cases are getting into the court room. When a case comes down to one person's word against another, getting a conviction is always going to be difficult – and sometimes impossible. But at least the authorities are trying."
2015-06-27,"A £166,000 Ferrari, cash, guns and swords were seized by police during a series of dawn raids targeting organised criminality in the traveller community.",https://web.archive.org/https://web.archive.org//web/20150627071105/http://news.sky.com/story/1508419/ferrari-and-guns-seized-in-traveller-raids,"A £166,000 Ferrari, cash, guns and swords were seized by police during a series of dawn raids targeting organised criminality in the traveller community. Senior detectives said they have arrested 20 people for a range of alleged offences, including money laundering, high-value theft and forced labour. Along with the 196mph supercar and ""substantial"" amount of cash, items including a Range Rover and a golf cart were confiscated by police. Chief superintendent Belinda Davies described the investigation - dubbed Purple Barracuda - as ""complex and sensitive"". ""Yesterday more than 250 officers executed a number of warrants at locations in Cardiff,"" she said. ""Suspected proceeds of crime ranging from luxury cars including a Ferrari and a Range Rover were seized along with a very substantial amount of cash ""One of the most critical elements was the protection of British and foreign nationals from forced labour and poor working conditions. ""Thirteen people who were found in various addresses were taken to a specialist reception centre where support is now being offered."" As part of the wider Operation Fulcrum, search warrants were executed at three locations across the Welsh capital - New House Farm, Shirenewton caravan site and a property in Newport Road, Rumney. Other alleged offences included the ""large scale abstraction of electricity"". Inspector James Dyson said the operation followed several months of planning and research. ""A police response such as this will no doubt have an impact on the traveller community within Cardiff and beyond,"" he said. ""With a view to this, there is an ongoing engagement process with Cardiff Council and the traveller community. ""The policing response was designed to reassure (people) that South Wales Police are there to represent and serve all, and will address any criminality and anti-social behaviour that exists."" No details on the age of the forced labour victims or where they are from have been released. Nor have the age or genders of those arrested."
2015-06-27,David Cameron's kickoff to EU renegotiation was just an interlude. A dinner palate cleanser.,https://web.archive.org/https://web.archive.org//web/20150627071105/http://news.sky.com/story/1508782/camerons-eu-speech-was-palate-cleanser,"David Cameron's kickoff to EU renegotiation was just an interlude. A dinner palate cleanser. A useful break from a torrid, emotional and angry debate about the handling of the Mediterranean migrant crisis. Italian Prime Minister Matteo Renzi accusing mainly Eastern European countries of ""time wasting"" of ""not deserving to be Europe"" and wrapping up with ""if this is your idea of Europe you can keep it"". The problem was the refusal of those countries to countenance the mandatory resettlement of 40,000 rescued migrants across the EU. The UK has an opt out, but an interest and an approach to the problem. The young Italian premier accused his fellow European leaders of ""lacking solidarity"". So Mr Cameron's brief contribution enabled EU Council negotiators to go away and redraft the communique on migration. For five minutes the PM spoke, he alone. It was brief, vague, and in the context, realistic. The President of the EU Council, Donald Tusk, agreed that it should host technical discussions on some of the UK concerns. He was the only council member to speak. The PM also repeated his view that any deal should be ""legally binding"" and ""irreversible"", but Number 10 admitted this would fall short of the full ratification of a new treaty by all members before a referendum. In other words, the public could end up seeing a change in the treaties, years after the referendum. It led both UKIP leader Nigel Farage to call the promise a ""post-dated cheque"" that could bounce. Labour said Mr Cameron's EU policy was ""a mess"". More happily for Mr Cameron, he has achieved the modest objective a starting renegotiations, and meeting every EU Council member within seven weeks of being re-elected. Significantly in the early hours of this morning, the Mr Tusk, for the first time, referred to the words ""UK renegotiation"" rather than referendum and reform. Also, Steve Baker, the MP who leads the Eurosceptic rebel group Conservatives for Britain, said his colleagues were ""realistic"" about the process of legal change. The telling point here is that even the EU's routemap for the Eurozone - the Five Presidents' report - does not envisage quick treaty change for an existential crisis of the single currency. That is a reflection of political reality. And if the member states cannot summon the political capital to do it to save the Eurozone, they will not do it to help Mr Cameron win a referendum that he chose for himself. The Five Presidents' Report itself was basically ignored at the summit, as the Eurozone focused on its near future. The crisis in Greece interfered and delayed proceedings at the summit, as finance minister talks broke down in a building next door. Yanis Varoufakis, Greece's finance minister, strolled over to the summit to brief his PM. EU leaders openly talked about preparing a Plan B for Grexit, which might involve bank holidays and capital controls by Monday. Another summit of Eurozone finance ministers will happen on Saturday, which makes the fourth meeting on that crisis this week. An immediate crisis of the single currency. And also on the shores of the Med, a test of the fundamental basis of solidarity within the EU. The Med crisis has posed questions about how much Italy and Greece will be helped with the humanitarian influx of migrants and refugees in boats. The furious and angry debate that sandwiched Mr Cameron's remarks on the UK raises question marks about the long term future of EU migration policy. An immediate crisis of the Schengen Area. One of Mr Cameron's aims is an opt-out from ""ever closer union"". Right now, with multiple crisis in its fundamental tenets around money and movement, the EU's members appear to be doing that all by themselves. The summit dinner could be a fundamental junction for the EU, with or without the UK."
2015-06-27,Scientists believe a computer game could help fight obesity by training people to resist unhealthy snack foods.,https://web.archive.org/https://web.archive.org//web/20150627071105/http://news.sky.com/story/1508599/online-training-game-may-help-fight-obesity,"Scientists believe a computer game could help fight obesity by training people to resist unhealthy snack foods. A trial of the game saw volunteers complete four 10-minute online sessions while keeping food diaries. The volunteers reported losing almost 1.5lb (0.7kg) in a week. After six months, they had shed nearly 4.5lb (2kg). The ""stop-go"" game sees players press keys in response to images flashed on a computer screen, while obeying a signal not to respond to others. Images of nine foods - including biscuits, chocolate and crisps - fall into the ""stop"" category, while images of healthy foods elicit a ""go"" response. Other pictures of inedible items such as furniture and gardening tools could fall into either the ""stop"" or ""go"" bracket. The game tries to train people to associate high-calorie foods with the act of ""stopping"". Scientist Dr Natalia Lawrence, from the University of Exeter, said: ""These findings are among the first to suggest that a brief, simple computerised tool can change people's everyday eating behaviour. ""It is exciting to see the effects of our lab studies translate to the real world. ""This research is still in its infancy and the effects are modest - larger, registered trials with longer-term measures need to be conducted. ""However, our findings suggest that this cognitive training approach is worth pursuing. ""It is free, easy to do and 88% of our participants said they would be happy to keep doing it and would recommend it to a friend. ""This opens up exciting possibilities for new behaviour change interventions based on underlying psychological processes."" Results of the study have been published in the journal Appetite."
2015-06-27,A mini-heatwave could hit Britain next week with temperatures of up to 30C in the South.,https://web.archive.org/https://web.archive.org//web/20150627071105/http://news.sky.com/story/1508221/temperatures-could-hit-30c-next-week,"A mini-heatwave could hit Britain next week with temperatures of up to 30C in the South. Even Scotland could see temperatures reach the mid-20s as intense heat from the continent pushes up over the Channel. But make the most of it, because it won't last long. Forecasters say that the high temperatures could last for just a couple of days before falling. Sky News weather producer Joanna Robinson said: ""There's lots of talk about the weather forecast for next week with the potential for our first spell of very high temperatures for this year, just in time for Wimbledon. ""In weather terms it's still a long way off and open to changes, but at the moment it looks like pressure will build early next week to bring mainly dry conditions and high temperatures. The hot weather could coincide with the start of Wimbledon ""A warm east or south-easterly flow is expected to develop by the middle of the week and temperatures could reach 30C (86F) in central or south-east England. ""It won't be quite as hot further north, but still very warm with temperatures in the low to mid-twenties. ""It looks to become humid as well, but the heat and humidity from the near continent could well bring the risk of thunderstorms to southern Britain by the end of the week."" Expect humid conditions if temperatures rise, and extreme heat if you're planning on travelling to some parts of Europe. A Met Office spokesman said: ""Very high temperatures are expected on the continent - Spain is likely to get into the 40s next week. ""That could rise up, giving us warm temperatures on Tuesday and Wednesday. ""There's a low probability along the south coast of temperatures in the high 20s and maybe even hitting 30 degrees. ""Even Scotland could see temperatures in the mid-20s. It'll be humid and sticky."""
2015-06-27,"Rare and valuable items held by libraries around the world are being ""raided"" by thieves, according to experts.",https://web.archive.org/https://web.archive.org//web/20150627071105/http://news.sky.com/story/1508552/tome-raiders-rare-items-stolen-from-libraries,"By Richard Suchet, Sky News Reporter Rare and valuable items held by libraries around the world are being ""raided"" by thieves, according to experts. The theft of historically important books, manuscripts and maps has become such a serious problem that international experts are gathering in London to discuss how to tackle it. A conference at The British Library, called The Written Heritage of Mankind in Peril, aims to produce a set of principles that will ""help prevent widespread theft and trafficking and restore stolen items to their rightful owners for the benefit of everyone"". Art Recovery International, which keeps a database of missing cultural objects, says more than 2,000 rare items have been reported missing or stolen since the beginning of March. The company's chief executive Christopher Marinello said: ""We have seen thieves use small cutting tools - little knives disguised in pencils or pens. ""We have even seen them use wet string to remove a rare map or page from a book and then they will try to sell it on the open market place. ""Thieves have seen the phenomenal prices that rare books, manuscripts and maps have achieved at auction and are now raiding our libraries of some very important cultural heritage. ""Thieves are looking to cash out as quickly as possible and they are looking at libraries as a weak point. ""We hear about the fantastic art thefts that are taking place in museums - they often make the news - but very few people know about what is going on in our public libraries and that is why this conference is so important."" The conference is the first of its kind and will be attended by dealers, auction houses, law enforcement officials, security experts, lawyers, collectors, national collections and others. Tens of thousands of historic books and manuscripts are thought to be missing or damaged. ""These are not things that can be replicated,"" says Jonathan Eyal from the Royal United Services Institute. The Defence and Security Forum has had rare military and regimental books stolen from its own library. ""The particular damage from any pilfering is very specific,"" Mr Eyal said. ""These are very specialised collections of books, which take centuries to assemble and five minutes to destroy. The significance of such a loss is incalculable. ""One of the key problems for libraries is less that of security - most special collections are quite good at the physical security - it's more a question of betrayal of trust by employees."" One solution could be to digitise the rarest and most valuable books so they would be both accessible and secure, but opponents of the idea say it detracts from the principle of libraries being a public resource. Speakers at The British Library conference will include Jerker Ryden, legal adviser to the Swedish library, which was at the centre of one of the world's most famous thefts. Senior librarian Anders Burius stole at least 56 books in the 1990s. He later committed suicide following his confession and arrest in 2004. It is also thought there are thousands of items belonging to The British Library that are missing, lost or have been stolen."
2015-06-27,The Queen and the Duke of Edinburgh have visited the site of the Bergen-Belsen concentration camp on the final day of their state visit to Germany.,https://web.archive.org/https://web.archive.org//web/20150627071105/http://news.sky.com/story/1508584/queen-visits-site-of-nazi-death-camp-horrors,"By Rhiannon Mills, Royal Correspondent, in Germany The Queen and the Duke of Edinburgh have visited the site of the Bergen-Belsen concentration camp on the final day of their state visit to Germany. It is the first time Her Majesty has visited such a site and it comes 70 years after Bergen-Belsen was liberated by British troops. Now a place of remembrance, there are no visible signs of what the camp once was. A memorial stone at Bergen-Belsen After it was liberated it was burnt to the ground to stop the spread of disease. It is estimated some 200,000 people were taken there during the Second World War and around 52,000 died. On 15 April 1945, when it was liberated by British and Commonwealth troops, some 10,000 bodies were found and thousands more were starving. Speaking ahead of the Queen's visit, Karen Pollock, chief executive of the Holocaust Educational Trust, said: ""I think for many Holocaust survivors and particularly British Holocaust survivors, to see the Queen visit Belsen to lay a wreath at one of the memorials, it sends a really strong signal that this is an important event in history that we should remember. ""I think that it means a huge deal to the survivors and, well, to all of us who care about Holocaust education and remembrance."" Jewish teenager Anne Frank, whose diaries were published after the war, was among those who died at Belsen, along with her sister. The royal couple paid tribute to them and the thousands of other victims. They also met some of those who survived and soldiers who liberated the camp. After the pomp and excitement that has welcomed them in Berlin and Frankfurt over the past few days, the Queen wanted today's events to be more personal and reflective. Gallery: Queen Elizabeth And Prince Philip Making State Visit To Berlin German Chancellor Angela Merkel and Queen Elizabeth smile as a robot waves at them during their visit at the Technical University of Berlin in Germany Writing about the visit for The Daily Telegraph, the chief rabbi of the UK, Ephraim Mirvis, highlighted the persecution still faced by Jewish people. ""In recent years, the Jewish community has been faced with newer and different types of hatred,"" he wrote. ""Recorded incidents of anti-Semitism have reached worrying levels and we have witnessed appalling, murderous attacks on Jewish targets around Europe. ""The Queen is herself of the generation which uncovered the Holocaust and had to come to terms over time with its scale and inhumanity. ""That makes today's gesture of solidarity and remembrance all the more relevant and appreciated."""
2015-06-27,THE PAPERS' TOP STORIES,https://web.archive.org/https://web.archive.org//web/20150627071105/http://news.sky.com/story/1509176/saturdays-national-newspaper-front-pages,"THE PAPERS' TOP STORIES :: Daily Express At least five British tourists were among 37 people killed by a gunman at a beach resort in Tunisia. :: Daily Mail The attacker was disguised as a tourist and hid his Kalashnikov under an umbrella before opening fire. Gallery: Saturday's National Newspaper Front Pages At least five British tourists were among 37 people killed by a gunman at a beach resort in Tunisia, reports the Daily Express :: The Times Foreign Secretary Philip Hammond said the British death toll was expected to rise to a ""high proportion"" of casualties. :: The Daily Telegraph The gunman was laughing as he attacked his victims. :: The Guardian It was the worst terrorist attack in Tunisia's recent history. :: Daily Mirror A hero Briton was shot repeatedly as he shielded his fiancee from the gunman on the beach. :: Daily Star A British teenager saw his father, mother and grandmother killed in the massacre. :: The i The carnage happened on same day as deadly attacks in France and Kuwait linked to Islamic State. :: The Sun The paper claims to have foiled a plot to bomb an Armed Forces Day parade in the UK. :: Financial Times Senior management at Deutsche Bank allegedly acted negligently over the fixing of Libor rates. :: Watch the Press Preview on Sky News every evening at 10.30pm and 11.30pm. Saturday night's reviewers will be The Times columnist Matthew Syed and journalist and author Nichi Hodgson."
2015-06-27,"A gunman disguised as a holidaymaker has killed at least 37 people, including five Britons, in an attack on a popular tourist resort.",https://web.archive.org/https://web.archive.org//web/20150627071105/http://news.sky.com/story/1508894/british-and-irish-tourists-die-in-beach-horror,"A gunman disguised as a holidaymaker has killed at least 37 people, including five Britons, in an attack on a popular tourist resort. Terrified sunbathers ran for their lives as the attacker, dressed in shorts and hiding his Kalashnikov inside an umbrella, opened fire on the beach in Port el Kantaoui on the outskirts of Sousse, Tunisia. He then entered the Imperial Marhaba hotel through the swimming pool area, shooting people as he went and also threw an explosive, witnesses said. Lorna Carty was among those killed in the Tunisia attack Tourists in the sea and on the sand ran and barricaded themselves in their hotel rooms after gunfire erupted, while medics used sunloungers to carry victims still in their swimming costumes. Foreign Secretary Philip Hammond confirmed at least five Britons had died and warned the number could rise. He said a ""high proportion"" of the casualties were expected to be British ""because of the nature of the resort"". Irish mother-of-two Lorna Carty, from Robinstown, Co Meath, was also killed. Family friends said she had taken her husband on holiday to help him recover from heart surgery. And the nurse, who was aged in her 50s, was believed to have gone to the beach by herself when the gunman went on the rampage. Tunisia's health ministry said British, German, Belgian and Tunisian nationals were among the dead. At least 36 people were injured in the assault, which happened just hours after a man was decapitated by an attacker brandishing Islamist flags at a French factory. The US State Department said there was no evidence the atrocities were co-ordinated. Earlier this week, Islamic State (IS) called on its supporters to increase attacks during Ramadan and ""be keen on waging invasion in this eminent month and commit martyrdom"". The gunman in Tunisia was a young student from the city of Kairouan who was reportedly unknown to authorities. He was later shot dead by police. Twitter accounts that support IS released three photos of someone they said was the gunman. Speaking about how the country's worst attack in recent history unfolded, Tunisian security official Rafik Chelli said the gunman ""had a parasol (umbrella) in his hand"". ""He went down to put it in the sand and then he took out his Kalashnikov and began shooting wildly."" A photo has emerged of a dead man wearing black shorts, face down in the street with an automatic weapon next to him and surrounded by police. The interior ministry had previously said two attackers were involved, including one who had fled the scene. Local radio said police captured a second gunman, but officials did not confirm the arrest or his role in the attack. British tourists have been describing what happened. Gary Pine said: ""We thought fire crackers were going off but you could see quite quickly what was going on. Gallery: Deadly Shootings In Tunisia A bloodied quiz book and sandals lie in the sand after an attack on a beach that left dozens killed, including five Britons and an Irish woman, and dozens of others hurt ""There was a mass exodus off the beach. My son was in the sea at the time and myself and my wife were shouting at him to get out and as he ran up he said I’ve just saw someone get shot. Holidaymaker Susan Ricketts said: ""It sounded like a machine gun going off. There are people crying and going hysterical. We just came up to our room."" Another tourist John Yeoman, who barricaded himself inside his hotel room using a bed and chair, said: ""People are running around the hotel. No-one has really been told what to do."" Prime Minister David Cameron said: ""The people who do this do it in the name of a twisted perverted ideology."" A British embassy crisis team is being sent to Tunisia after a COBRA meeting took place to co-ordinate a response. Travel companies have offered tourists the chance to change their holiday bookings to Tunisia in light of the attack. Thomas Cook said customers due to travel between Friday and Sunday can cancel their holidays free of charge, while those flying out from Monday up to July 24 can amend bookings for holidays to Tunisia free of charge. People booked through Monarch or Cosmos Holidays in the next seven days can also choose not to travel and instead change their destination. Tui, which runs Thomson and First Choice, could not confirm whether it operated tours through the hotel. Back in March Sky's Sherine Tadros reported that the bulk of foreign fighters who have joined the ranks of IS come from Tunisia. Meanwhile, deadly explosions have hit a Shiite mosque in Kuwait's capital after Friday prayers. Dozens of people were killed and many others wounded in the attack. Following the day of violence, British police are putting extra security measures in place for events this weekend, including Armed Forces Day and Pride London. :: The Foreign Office says that anyone concerned about friends or relatives in Tunisia should call their switchboard on 020 7008 1500"
