date,program,link,transcript
2015-08-15,The Duke and Duchess of Cambridge have released a strong warning to paparazzi to stop harassing their children.,https://web.archive.org/https://web.archive.org//web/20150815113448/http://news.sky.com/story/1535714/palace-warns-paparazzi-stay-away-from-george,"By Rhiannon Mills, Royal Correspondent The Duke and Duchess of Cambridge have released a strong warning to paparazzi to stop harassing their children. The communications secretary for Kensington Palace has written an open letter to the media, highlighting how Prince George and Princess Charlotte are increasingly under surveillance from unauthorised photographers. The letter praised British, Australian, Canadian and New Zealand media for respecting the family's privacy, adding: ""The Duke and Duchess are glad that leaders in the media industry share the view that every child, regardless of their future public role, deserves a safe, happy, and private childhood."" George arriving at hospital to visit his sister for the first time Thanking the public for messages of support, they also promised that official opportunities to photograph the children would become ""a regular occurrence"" as they grow older. The Metropolitan Police warned that photographers were at risk of being shot by armed officers if it was felt there was a safety or security risk to the royals.  The Duke and Duchess are still ""upset"" that ""a small number of paparazzi photographers"" are going to extreme lengths to satisfy a large international market for unauthorised photos of the children, however. They said long lenses had been used to capture images of the Duchess and Prince George in private parks and to monitor George, his nanny, household staff and visiting children. They said cars leaving the family's homes had been followed and other children had even been used to lure the young prince into the view of photographers while playing in playgrounds. The letter said that, like most parents, the couple enjoyed sharing photos of their children, but added that every parent would object to anyone - particularly strangers - taking photos of their children without permission. ""Every parent would understand their deep unease at only learning they had been followed and watched days later when photographs emerged,"" it added. The letter added that Prince George is currently that market's ""number one target"" and the decision had been made to ""discuss"" this as incidents became ""more frequent and the tactics more alarming"". One incident last week was described as ""disturbing but not at all uncommon"". A photographer had rented a car and parked in a discreet location outside a children's play area. Gallery: Duchess Of Cambridge's Pictures Of Her Little Prince And Princess The photos were taken by the Duchess of Cambridge in the middle of May Concealed by darkened windows, he also hung sheets inside the vehicle and created a hide stocked with food and drinks to get him through a full day of surveillance, waiting in hope to capture images of Prince George, the palace said. Police discovered him lying in the boot of the vehicle trying to take photos with a long lens through a small gap in his hide. The palace's letter added: ""It is of course upsetting that such tactics – reminiscent as they are of past surveillance by groups intent on doing more than capturing images – are being deployed to profit from the image of a two-year old boy. ""In a heightened security environment such tactics are a risk to all involved. The worry is that it will not always be possible to quickly distinguish between someone taking photos and someone intending to do more immediate harm."" Gallery: Prince George: William And Kate's First Child The Duke and Duchess of Cambridge released new photos of their son as he prepared to celebrate his second Christmas Kensington Palace has said that legal steps are being taken to safeguard the family but they hope the letter will encourage public debate and help publishers of unauthorised photos of the children to understand the power they hold to ""starve this disturbing activity of funding"". The Met Police said: ""At a time when the national security threat level from international terrorism is at severe, all officers are at a heightened level of readiness. ""Officers involved in the security of protected people are armed and have to constantly assess security risks. ""Photographers using covert tactics often come to the attention of armed officers who take steps to stop and verify the details of those who raise suspicions. Gallery: George's First Official Engagement Prince George shows he is growing up fast as he joins a baby playgroup for the first time while visiting Wellington, New Zealand. ""Photographers are potentially putting themselves at risk from armed intervention where our armed officers perceive a risk to the personal safety of their principal, the public and themselves."" Paddy Harverson, former communications secretary to the Royal family said the situation was ""palpably worse than in the 1980s"". ""There’s a lot more freelance paparazzi out there that don’t obey anyone's rules and I think there’s a media obsession with very young children and babies of the famous, the celebrity, in this case the royals, and therefore there’s a bigger market than there was back in the 80s,"" he said.  Sky News does not publish images of the Royal family taken by unauthorised photographers."
2015-08-15,"Islamic State leader Abu Bakr al Baghdadi repeatedly raped American hostage Kayla Mueller, according to accounts provided to US intelligence officials.",https://web.archive.org/https://web.archive.org//web/20150815113448/http://news.sky.com/story/1536050/islamic-state-leader-raped-us-hostage,"By Sky News US Team Islamic State leader Abu Bakr al Baghdadi repeatedly raped American hostage Kayla Mueller, according to accounts provided to US intelligence officials. Ms Mueller, whose death was confirmed in February, is said to have been kept by Islamic State financier Abu Sayyaf and his wife, Umm Sayyaf.  According to a Yazidi teenager who was held with 26-year-old Ms Mueller, al Baghdadi took the American as his ""wife"", repeatedly forcing her to have sex when he visited. Abu Bakr al Baghdadi is said to have taken Ms Mueller as his 'wife' Mueller family spokeswoman Emily Lenzner told the Associated Press news agency the 14-year-old Yazidi girl, who later escaped, spoke to US officials. They checked out her story before passing it on in June to Kayla Mueller's parents, Carl and Marsha Mueller, Ms Lenzner added. An unnamed US official confirmed the account, which was first reported by The Independent. According to the newspaper, Ms Mueller was kept in a room with four Yazidi teenagers, whom she tried to protect from abuse by Umm Sayyaf and militants. The girls are said to have regarded Ms Mueller as a ""mother figure"". The American aid worker would leave the room when al Baghdadi visited and weep afterwards as she told the Yazidi girls about the sexual abuse she had suffered, reports the newspaper. Abu Sayyaf, a Tunisian, was killed in a US special forces raid on his Syrian compound in June, which American officials said reaped vital intelligence about IS. Umm Sayyaf, who was detained during the raid, is said to have co-operated with US interrogators and has been turned over to the Iraqi Kurds for trial. Ms Mueller, from Prescott, Arizona, was taken prisoner in Aleppo, Syria, in August 2013. IS said she died when Jordanian warplanes struck the building where she was being held, though they offered little proof for the claim. The Mueller family released a heart-wrenching letter she wrote to them from captivity in which she said she had been ""treated w/ the utmost respect + kindness"". ""Do not fear for me,"" she said in the letter, which is widely thought to have been written under duress."
2015-08-15,A Pennsylvania man who spent more than three decades behind bars for the rape and murder of a 15-year-old girl has been freed after a DNA test.,https://web.archive.org/https://web.archive.org//web/20150815113448/http://news.sky.com/story/1535430/dna-test-frees-man-after-34-years-in-prison,"By Sky News US Team A Pennsylvania man who spent more than three decades behind bars for the rape and murder of a 15-year-old girl has been freed after a DNA test. A judge voided 63-year-old Lewis Fogle's 1982 conviction on Thursday. Fogle, who had denied shooting Deann Long in the head in 1976, told WPXI-TV upon release that he was looking forward to a steak dinner. His tearful wife, Deb Fogle, who wed him three months before his conviction, was waiting for him outside court and said she always believed he would be cleared. Lewis Fogle and wife Deb. File pic The Innocence Project, a group that works to exonerate wrongfully convicted people, had led calls for new DNA testing in the case. It said sperm evidence had ""excluded Fogle and pointed to an unidentified male"". ""This has been an extremely long journey for Mr Fogle, who has always maintained his innocence of the 1976 crime,"" said David Loftis, of the Innocence Project. District Attorney Patrick Dougherty conceded the conviction ought to be thrown out after agreeing to the new DNA test. But he told Reuters news agency he does not believe Fogle is wholly innocent of involvement in Miss Long's death. The prosecutor said he would decide by next month whether to retry Fogle. Fogle has been released on a bail bond as he remains charged. He was among four men arrested in 1981 after a mental health patient identified them under hypnosis as suspects. Fogle was convicted of second-degree murder based on the testimony of three jailhouse informants. Charges against his three co-defendants were dropped for lack of evidence. The district attorney said he would seek DNA from two of the other three men originally charged who are still alive."
2015-08-15,A pigeon smuggling cocaine and cannabis into a prison in Costa Rica has been caught by guards.,https://web.archive.org/https://web.archive.org//web/20150815113448/http://news.sky.com/story/1535734/pigeon-caught-flying-drugs-into-prison,"A pigeon smuggling cocaine and cannabis into a prison in Costa Rica has been caught by guards. The bird was seen landing in the central concourse of the medium security La Reforma jail, in San Rafael de Alajuela, where it was taken into custody. The drugs were contained in a small zipped up pouch strapped to the animals chest. About 14g of cocaine and at least the same amount of cannabis were inside wrapped in plastic. Costa Rica's Ministry of Justice and Peace released the animal's mugshot under the headline caption ""narcopaloma"", meaning ""drugs dove"", and listing the date of the animals detention. Realidad7 reported the drugs had a street value of around £180 ($281). Prison officials said they believe the drugs were destined for use by an inmate who may have trained the pigeon to act as a courier. Director of the Penitentiary Police, Paul Bertozzi, told Spanish news agency Efe that it showed the need to be vigilant. ""Drug traffickers are using unimaginable ways to achieve their macabre atrocities,"" he said. ""This (use of a pigeon) is nothing new. In the past (the traffickers) have used cats and dogs to pass drugs to prisoners. Now it seems they are using pigeons to carry in their wares from the outside."" Although it is the first time the Costa Rican authorities said they had come across the practice, it has previously been reported in Argentina in 2013 and Colombia in 2011. The pigeon was later taken to a zoo where it was expected to remain behind the bars of a cage. Biologist Oscar Ramirez told Realidad7 that pigeons can be trained to travel several miles with small loads. During the Second World War, more than 250,000 homing pigeons were used to transport messages between front line Allied troops and top brass, according to the Royal Pigeon Racing Association."
2015-08-15,"Lord Janner has appeared at Westminster Magistrates' Court to attend a child sex abuse hearing, after failing to turn up earlier.",https://web.archive.org/https://web.archive.org//web/20150815113448/http://news.sky.com/story/1535829/lord-janner-in-court-to-face-child-sex-charges,"Lord Janner has appeared at Westminster Magistrates' Court to attend a child sex abuse hearing, after failing to turn up earlier. Wearing a baseball cap, the 87-year-old peer was driven into a side entrance in the rear of a grey Toyota Avensis. During a court appearance that lasted less than two minutes, Lord Janner, who has dementia, appeared pale and frail, said Sky's Martin Brunt. Reporters waiting for Lord Janner at Westminster Magistrates' Court earlier Dressed in a green cardigan, blue t-shirt and navy trousers, he said ""Oooh, this is wonderful"" as he entered the courtroom and replied ""Yes"" when asked if he was Lord Janner. After he was read his charges, he was released on unconditional bail and was allowed to leave, following his daughter out. Gallery: Lord Janner In Court Lord Janner arrived at Westminster Magistrates' Court to attend a child sex abuse hearing Calling him ""daddy"", the woman said: ""We're going to go home and have an ice cream."" Lord Janner faces 22 charges relating to offences alleged to have taken place between the 1960s and the 1980s. The case was sent on to Southwark Crown Court, with the next hearing set for 1 September. Friday's hearing at a packed courtroom initially got under way without him, even though he had been ordered by a High Court to attend, leading the judge to threaten arrest. Much of the morning was taken up by his lawyers arguing that a court appearance would be too distressing for the peer. They sought to have him appear via video-link, citing his poor condition. Gallery: Lord Janner Has Spent Much Of His Life In The Public Eye Greville Janner was born on July 11, 1928 in Cardiff. He attended St Paul's School in London and during World War Two travelled to Canada as an evacuee. He went to school in Quebec But the argument was rejected by District Judge Emma Arbuthnot, who, amid the legal wrangling, appeared to lose patience. She told the defence lawyer to ""stop messing around"" and added: ""I'm warning you that as time progresses I'm going to turn to the prosecution and say, 'Lets get a warrant to have him arrested. Let's not waste time.'"" The peer, whose full title is Baron Janner of Braunstone, was a QC and then MP for Leicester West until his retirement from the House of Commons in 1997 when he joined the Lords. He has been on a leave of absence from the Lords since October 2014 as a result of his illness. Earlier this week, his lawyers had sought to prevent Lord Janner from having to attend the hearing, on grounds of his poor health and the risk of an injury. But High Court judges ruled on Wednesday that public interest outweighed any personal distress that might be caused to him."
2015-08-15,"A small parcel bomb has exploded in a postal van at an army barracks near Belfast in a ""reckless"" attack slammed by Unionists as attempted murder.",https://web.archive.org/https://web.archive.org//web/20150815113448/http://news.sky.com/story/1535987/army-base-van-explosion-was-attempt-to-kill,"A small parcel bomb has exploded in a postal van at an army barracks near Belfast in a ""reckless"" attack slammed by Unionists as attempted murder. The Police Service of Northern Ireland (PSNI) confirmed there had been an explosion at the back of the vehicle in the Palace Barracks in Holywood. The postal worker who had been driving the van was not inside when the blast took place. A fire broke out which then spread to two other vehicles and nearby garages within the complex. There were no reports of any injuries following the blaze but there was widespread damage to the van. Police have said they are working with the Royal Mail ""to mitigate any potential threat"" posed by parcel bombs.  Superintendent Karen Baxter from the PSNI said: ""Fortunately the postal worker who had been driving this van was not inside when the explosion occurred. The attack happened at the Palace Barracks in Holywood ""Although we have no information to suggest there may be other similar packages in the postal system we are working closely with Royal Mail to mitigate any potential risk."" Soldiers from The Royal Scots Borderers The Royal Regiment of Scotland have been stationed at the barracks since August 2014. The base, a few miles from Belfast, also houses the Northern Ireland headquarters of secret service MI5. Democratic Unionist Party (DUP) Stormont Assembly member Alex Easton said: ""I am deeply angry and concerned that there has been an attempt to kill somebody or soldiers inside Palace Barracks. ""This is a very worrying development and I would totally and utterly condemn it. ""I am just relieved no one was seriously injured or killed and I would appeal to anyone who has any information to bring it to police to put those involved behind bars where they belong."" Northern Ireland Secretary Theresa Villiers said the attack was ""reckless"" Northern Ireland Secretary Theresa Villiers said the attack was ""reckless and futile"". She said: ""Those responsible for sending this postal device showed a reckless disregard for the safety of postal workers and others doing their jobs. ""There is nothing to gain from this."" In April 2010, a car bomb exploded outside the army base in an attack claimed by the Real IRA, a dissident republican organisation opposed to the peace process. In May this year, two bombs were discovered close to an army reserve base in Londonderry."
2015-08-15,Drivers are experiencing severe delays on one of the country's busiest roads after a lorry collided with a pick-up truck.,https://web.archive.org/https://web.archive.org//web/20150815113448/http://news.sky.com/story/1535868/weekend-getaway-chaos-as-part-of-m6-closed,"Drivers are experiencing severe delays on one of the country's busiest roads after a lorry collided with a pick-up truck. The M6 is closed in both direction between junction six and junction seven in Birmingham, with diversions in operation, the Highways Agency said. West Midlands Fire Service said one man was cut out of a vehicle and taken to hospital after the crash just before 11am. The road is expected to be closed until at least 5pm, with the Highways Agency warning travellers should use alternative routes or delay their journey. Long delays mean that queues are building on the M6 southbound from junction 10 (the M54 link) and on the M5 northbound, which is affected by the M6 closure at junction seven. Delays were also building on the M5 northbound from junction three towards the M6 link at junction eight. Among those affected will be fans travelling to tonight's match between Manchester United and Aston Villa in Birmingham, with both teams warning drivers to plan ahead and consider other routes."
2015-08-15,Seven people have appeared in court over the largest seizure of weapons of their kind in the UK.,https://web.archive.org/https://web.archive.org//web/20150815113448/http://news.sky.com/story/1535791/seven-people-in-court-over-kent-guns-seizure,"Seven people have appeared in court over the largest seizure of weapons of their kind in the UK. Police seized 22 automatic assault rifles, nine Skorpion machine pistols, 58 magazines, two silencers and around 1,000 live rounds of ammunition from a van on Tuesday afternoon. The guns were hidden in holdalls and a suitcase in the van at Cuxton Marina in Kent. Magazines and ammunition were seized They were seized as the vehicle was leaving the marina following the arrival of a motor cruiser that had come across from France. The operation followed an investigation by the National Crime Agency (NCA) into the suspected importation of firearms. A total of eight arrests were made in the Kent towns of Cuxton, Orpington and Swanley, resulting in seven people being charged with importing and possessing firearms. NCA deputy director Graham Gardner said: ""This was an extremely significant seizure, the largest of its kind in the UK. Skorpion machine pistols ""I've no doubt that these weapons would have ended up in criminal hands and it goes without saying the risk they would have posed to the public. ""We are still in the early stages of a significant investigation which will continue for some time."" The six men and one woman appeared by video link at Medway Magistrates' Court. They are: David Payne, 42, of Rochester; Jennifer Arthy, 41, of Rochester; John Smale, 58, of Rochester; Christopher Owen, 29, of Rochester; Harry Shilling, 22, of Swanley; Michael Defraine, 29, of Bexleyheath; and Richard Rye, 24, of Swanley. All seven were remanded in custody and will next appear at Maidstone Crown Court on 4 September. A 28-year-old man from Swanley has been released on bail pending further inquiries until 24 September."
