date,program,link,transcript
2015-08-14,British athletes have hit out over the absence of the Union Jack flag on part of their kit for the upcoming World Championships in Beijing.,https://web.archive.org/https://web.archive.org//web/20150814232246/http://news.sky.com/story/1535628/gb-athletes-in-missing-union-jack-flag-row,"British athletes have hit out over the absence of the Union Jack flag on part of their kit for the upcoming World Championships in Beijing. Olympic long jump champion Greg Rutherford was the first to complain when he tweeted a picture of the kit's top and posted a comment alongside. He said:  ""Well this isn't right ... Where's the Union Jack!?!? @BritAthletics (this is the kit for worlds)."" Several present and former members of the British athletics team joined him in criticising the lack of the national flag. The top is similar in style to the one team members have been wearing in recent months, with a blue and white front, separated by a chevron, and red sides. But, unlike the one he wore in July, Rutherford's top shows the logo of British Athletics rather than the flag. Britain's Greg Rutherford competes in the Anniversary Games in July He added: ""I'm yet to find an athlete who wanted the change. EVERY athlete I've spoken to wants the Union flag. ""Most annoyingly about all this is that the kit itself is amazing! IMO the best kit to compete in material-wise. Just looks s***."" Paralympic 2012 quadruple gold medallist David Weir replied to Rutherford, adding: ""We all put the kit on for the flag. And I couldn't see any other country do it."" Steeplechaser Eilish McColgan said: ""It's unfair for athletes not supported by UKA to have to wear it ... Doesn't make any sense! Bring back the flag!"" Dame Kelly Holmes, a double Olympic champion at Athens in 2004, responded on Twitter: ""Totally agree. The Union Jack is iconic."" Shadow culture, media and sport secretary Chris Bryant lent his support, tweeting: ""Yes @GregJRutherford is right. That vest could easily be French or American. ""Where is the Union flag? Is someone embarrassed to be British?"" The full British kit posted on Instagram by athlete Cindy Ofili Rutherford pointed out that the 2012 London Olympics kit for Team GB - designed by Stella McCartney - featured a Union Jack flag prominently. British Athletics did not respond to the complaints directly but retweeted an Instagram post from hurdler Cindy Ofili, who said: ""Excited to have finally received my first full British Kit!! Thanks britishathletics"". The kit that she had laid out appeared to have several items that sported Union Jack flags. A spokesman later told Sky News: ""In regards to the new kit design, we would reassure athletes and fans that the Union Flag remains an integral part of the British Athletics team kit, and is included on the majority of items worn by the team, complemented by the words Great Britain across the chest. ""The inclusion of the British Athletics team name and logo is to help create a strong team identity for the British Athletics team. ""This follows the tradition of the vast majority of other Olympic sports, such as swimming and cycling, who have used their team name and logo on kit design for years, and creates a powerful team identity. ""This approach was also adopted very successfully by TeamGB when, in 2012, they replaced the traditional Union Flag with the TeamGB logo that resonated so strongly with the British public."" A total of 63 athletes are being sent to China for the World Athletics Championships, captained by 400m runner Martyn Rooney."
2015-08-14,A man who entered a restricted area at an amusement park in Ohio to look for a lost mobile phone has died after being struck by a rollercoaster.,https://web.archive.org/https://web.archive.org//web/20150814232246/http://news.sky.com/story/1535491/rollercoaster-kills-man-looking-for-lost-phone,"By Sky News US Team A man who entered a restricted area at an amusement park in Ohio to look for a lost mobile phone has died after being struck by a rollercoaster. James Young was hit by the 57mph Raptor ride at the Cedar Point amusement park on Thursday. Police said Mr Young had just been on the ride when he jumped over a fence ""to retrieve something he had dropped"". The Erie County coroner said the item was a mobile phone. The amusement park sits along Lake Erie in Sandusky and describes itself as the ""rollercoaster capital of the world"". The park confirmed the death in a statement saying ""a guest entered a restricted, fenced area of Raptor and was struck by the ride"". It added that its ""thoughts and prayers go out to the family""."
2015-08-15,A German bus driver who used his rusty high-school English to welcome refugees has been praised after his speech went viral.,https://web.archive.org/https://web.archive.org//web/20150815113448/http://news.sky.com/story/1535666/bus-driver-tells-migrants-youre-welcome,"A German bus driver who used his rusty high-school English to welcome refugees has been praised after his speech went viral. Sven Latteyer thought the 15 asylum seekers who boarded his bus in the city of Erlangen seemed in need of cheering up, perhaps feeling a bit lost in a new country, he told thelocal.de. Mr Latteyer, who is reported to be 42, said he managed to string together a few sentences in English, saying: ""I have an important message for all people from the whole world in this bus: I want to say welcome. ""Welcome to Germany, welcome to my country. Have a nice day!"" One passenger posted about the moment on Facebook, where thousands of people read how the speech was greeted with ""incredulous looks, then all laughing and clapping, the whole bus, including the Germans"" and ""one of the African boys wiped a little tear from his eyes"". Gallery: Plight Of Refugees On Greek Island Of Kos A dinghy overcrowded with Syrian refugees off the Greek island of Kos Mr Latteyer told nordbayern.de he had been inspired to welcome the newcomers through knowing the experiences of his Kosovan brother-in-law and his German grandfather who lost his arm in World War Two. He said: ""My brother-in-law doesn't talk a lot about the years 1998 and 1999 when the war was raging in Kosovo. He's trying to forget the horror."" Mr Latteyer, who is also a volunteer firefighter, added that war is ""horrific"" and anyone fleeing it should be given refuge in Germany. He said he wasn't sure how he could help the migrants but the answer turned out to be simple: ""Saying 'hey guys, you're really welcome'."" The story even touched TV presenter Claus Kleber, who appeared teary as he reported it on ZDF television's daily news. The number of people seeking asylum in European countries has increased substantially, with most coming from places such as Syria, Afghanistan and Eritrea. Gallery: Desperate Syrians Flee To Turkish Border A Syrian refugee reacts as he waits behind border fences to cross into Turkey at Akcakale border gate in Sanliurfa province Germany has received almost 180,000 applications for asylum in the first half of this year - twice the number it had received during the same period last year. Erlangen's local government says about a quarter of the population there - around 27,000 people - have an immigrant background. But not everybody has been as welcoming of the newcomers, with a surge in attacks on their accommodation, including vandalism and arson by far right groups."
2015-08-15,It is more than three months since David Cameron secured a shock majority in the General Election. Sky's Sophy Ridge takes a look at what the PM has got up to since he stepped back into Downing Street.,https://web.archive.org/https://web.archive.org//web/20150815113448/http://news.sky.com/story/1536078/camerons-first-100-days-what-has-the-pm-done,"It is more than three months since David Cameron secured a shock majority in the General Election. Sky's Sophy Ridge takes a look at what the PM has got up to since he stepped back into Downing Street. 1. First things first. Mr Cameron won the election. Which is pretty obvious, since that is why we are here. 2. The newly elected Prime Minister ordered champagne to No 10 to celebrate the first Conservative majority government for nearly 20 years. 3. He also got a swanky freebie hamper from Fortnum and Mason. 4. Some of his aides held a Club Tropicana party - because the year the song came out (1983) was the last time an incumbent Prime Minister increased his majority. Cameron's new Cabinet had some familiar faces 5. Mr Cameron then formed a Cabinet which was pretty much the same as the last one. It had the same Chancellor, Home Secretary, Foreign Secretary, Defence Secretary, Education Secretary, Health Secretary ... the list goes on. 6. Apart from Business Secretary Sajid Javid. He was new. 7. And Michael Gove moved to the Department of Justice, where he swapped being a thorn in the side of teachers to being a thorn in the side of lawyers. 8. Mr Cameron also promoted more women to Cabinet. 9. And allowed cameras in for the first time, so we can see them in action. 10. Now for the first meaty piece of legislation: the EU Reform Bill. Legislation paving the way for an in-out referendum on Britain's membership of the EU has nearly finished its passage through the Commons. 11. The PM knows that if he is to get the result he wants, he needs to renegotiate Britain's relationship with Europe. So he kicked off a whistle stop tour to try and convince other leaders - starting with Dutch Prime Minister, Mark Rutte. Cameron complained his jet-setting meant he wasn't beach body ready 12. Then it was off to Paris to butter up French President Francois Hollande. 13. ... and Poland, to meet Ewa Kopacz. 14. ... before flying to Germany to cosy up to Angela Merkel. (I am exhausted just thinking of it.) 15. He did not go to Denmark to meet his fave EU ally Helle Thorning-Schmidt (remember THAT selfie with Obama???) - aka Mrs Stephen Kinnock. Unfortunately for Dave, she called a snap general election ... and lost.   16. But Mr Cameron DID meet arch-nemesis Jean-Claude Juncker, who he tried to block from becoming EU Council President. He must REALLY want this whole EU reform thing. 17. This guy is on a serious charm offensive - and even Barack Obama weighed in on the issue, telling the PM at G7 that he was ""looking forward to Britain sticking with the EU. 18. The problem is - nobody took much notice because they were too distracted by the crisis in Greece. Think of all those wasted air miles. 19. There was another downside to his EU tour. Mr Cameron blamed all the posh dinners and three course breakfasts for the fact he was not as beach body ready as his wife Sam Cam, who was busy looking fantastic in a black bikini while he was darting across the continent. He explained: ""I'm not as good at controlling what goes in."" 20. His waistline was probably also not helped by a trip to South East Asia. Papilionanda David Cameron, an orchid named for the Prime Minister 21. Although on the plus side, he did have an orchid named after him in Singapore 22. The PM hopes he will be more successful in controlling the benefits bill - he has stuck to his promise of £12bn welfare cuts, which many thought he would quietly drop. 23. He cut the welfare cap from £26,000 to £20,000 - or £23,000 in London. The Conservative manifesto only talked about cutting it to £23,000. 24. Working age benefits have been frozen for four years 25. Pensions tax relief has been cut... 26. And tax credits have been seriously squeezed - with £5bn of cuts by 2020. 27. Despite this, the Prime Minister has been forced to admit the deficit will be cleared later than planned - with a promise to get the budget in surplus by 2019/20, a year later than he originally said. 28. After all that hard work, it was time for a holiday. So the PM went to his favourite staycation destination: Cornwall. 29. This is mainly memorable because he wore Fit Flops (Sam Cam - how could you let him?!) 30. And THAT blue shirt ... you know, the same one he always wears in his holiday snaps? Smart casual is SUCH a hard look for a Prime Minister to nail. 31. The Cameron family then packed up and jetted off to Portugal for holiday number two. Cameron sent sniffer dogs as the migrant crisis in Calais gained momentum 32 …. where he had to receive medical treatment for ""swimmers ear"" - or inflammation of the ear canal. Not great for chillaxing. 33. Also not great for chillaxing? The fact that Calais erupted into crisis, with thousands of people trying to make the crossing from France to the UK. 34. David Cameron was not prepared to interrupt his holiday. But that was totally fine because he sent lots of sniffer dogs. 35. Also - tall fences. 36. And he allowed Ministry of Defence land in Kent to be used as a giant lorry park. (This is not a joke. It actually happened.) 37. He has also chaired a LOT of Cobra meetings. COBRA - the tough sounding emergency committee that actually stands for Cabinet Office Briefing Room A - is the PM's favourite way to show he is really on top of a crisis. 38. Mr Cameron also unveiled a raft of REALLY TOUGH new policies to show the government has GOT A GRIP on the migrant crisis. For instance, he promised to stop benefits for failed asylum seekers. 39. Landlords who knowingly give accommodation to illegal immigrants could also face up to five years in jail. 40. The Prime Minister did get into some hot water when he described a ""swarm"" of migrants trying to get to the UK. Some felt that was dehumanising. 41. Number 10 also declined to slap down Foreign Secretary Philip Hammond who said the migrants were ""marauding"". According to the Oxford English Dictionary, marauding means ""going about in search of things to steal or attack"". Which, some felt, was a bit much. 42. David Cameron is also pushing through an Immigration Bill. Cameron wore the blue shirt he seems to keep for holiday photos 43. People in customer-facing public sector jobs must be able to speak English. 44. And firms will not be able to recruit from abroad without also advertising in the UK. 45. Mr Cameron has refused to back down from his promise to reduce net migration to the tens of thousands - even though he is nowhere close. 46. But he is doing much, much better on poverty. In fact - it has been abolished! (or at least, poverty targets have been.) 47. Mr Cameron called for a ""big conversation"" on ... seagulls. Yes, that is not a joke. He told BBC Radio Cornwall ""we do have a problem"" about aggressive seagulls. 48. There has been some good news for families and employees struggling on low incomes - Mr Cameron has announced he will legislate to create a new living wage. 49. Plus, he is doubling the amount of free childcare for working parents. 50. However, it is not good news for everyone - child tax credits will be limited to the first two children. 51. Plus - not everyone is celebrating a pay rise. The government is continuing to cap public sector pay rises at one per cent a year, right up until the next general election. This means public sector workers face a full decade of wage restraint. Ouch. 52. He has also frozen ministerial pay. We are all in this together... Cameron has called for a ""big conversation"" on seagulls 53. … or are we? Because MPs will still be getting a 10% pay rise. David Cameron says he does not agree with it, but he is not prepared to overrule the expenses watchdog IPSA. 54. He also used the words ""we are all in this together"" in a speech about terrorism - rather than the economy. 55. And floated the idea of British involvement in air strikes in Syria. 56. In his spare time since the election, David Cameron is often seen out running (maybe so he can escape from all those angry civil servants who are not getting a pay rise). 57. He even interrupted an outside broadcast by This Morning. Presenter Amanda Holden could not quite believe it when she saw the Prime Minister jogging through her set on London's Southbank. 58. All that exercise is clearly paying off. Uber-cool super model Poppy Delevigne admitted she ""quite fancies him"" in an interview with her sister Cara. David Cameron - sex symbol! 59. If social media is anything to go by, he has had selfies taken with a LOT of people. 60. Mr Cameron does not have every leggy blonde falling at his feet, though. Tennis ace Maria Sharapova did not see the funny side when the Prime Minister cracked a joke at her expense, saying you need earplugs at her matches. 61. He made this joke to the England Women's football team, who the PM hosted at Downing Street to celebrate their World Cup performance. Miodel Poppy Delevingne says she ""quite fancies"" the PM 62. Mr and Mrs Cameron also invited Michelle Obama to No 10 during her two day trip to the UK with her daughters. 63. One chunky piece of legislation that could define Mr Cameron's government is the Scotland Bill. Work has started on new laws that would transfer more powers to Scotland, after the impressive general election results achieved by the SNP. 64. To try and thrash out agreement, Mr Cameron travelled to meet with SNP leader Nicola Sturgeon at Bute House in Edinburgh. Oh to be a fly on that wall. 65. Their relationship has not always run smoothly, however. Mr Cameron had to shelve plans for a vote on fox hunting after the SNP decided to vote against the change. 66. That just goes to show that he may have won a surprise election victory, but he has a really, really small majority. Which could be tricky in the future. 67. He also put off a vote on plans for English votes for English laws, despite originally promising to settle the issue before the summer recess. 68. That is not the only thing Mr Cameron has kicked into the long grass. The Davies Commission unequivocally recommended expanding Heathrow Airport. The Prime Minister reacted by delaying a decision ... that could not have anything to do with the Tory constituencies in the Heathrow flight path, could it? 69. Mr Cameron also launched a ""consultation"" on shops opening times on Sundays. That is what politicians do when they know something is going to be controversial. US First Lady Michelle Obama came to visit 70. There are a few other things that the Prime Minister has been strangely silent about. Remember the Northern Powerhouse rail link, promised in the manifesto then quietly shelved? 71. Although to be fair, he has cut corporation tax. 72. And inheritance tax. 73. And raised the basic rate income tax threshold to £11,000 from next year, with the higher rate also rising to £43,000. 74. And committed to a seven day a week NHS. 75. He has also stuck to his guns (unsurprisingly) on the Trade Union Reform Bill, which sets a 50% turnout threshold for strike ballots. 76. And he has banned legal highs. Or should that now be illegal highs? 77. Mr Cameron is not above nicking the best bits from other party's manifestos. He has abolished permanent non-dom status. If that sounds familiar, it is because Ed Miliband promised to do it if he got in power. 78. He successfully remembered to wish his favourite football team Aston Villa good luck before their FA Cup final clash - despite getting them confused with West Ham during the General Election campaign. 79. But he did not manage to turn up and cheer them on. Which is just as well, really, since they lost 4-0 to Arsenal. Cameron wished Aston Villa well in the FA Cup Final - but they lost 4-0 80. Mr Cameron came in for criticism for selling off RBS shares at what some considered too low a price. 81. He also controversially sold off shares in Royal Mail. 82. And told the BBC it needs to pick up the cost of free TV licenses, rather than the government. 83. David Cameron became ""mesmerised"" by colourful Kids Company founder Camila Batmanghelidjh. 84. So mesmerised that he gave the nod to a £3m cheque to her charity. 85. And then quickly became rather less mesmerised, when the charity shut down a week later amid claims of financial irregularity. 86. He has also watched on as the leaders of Labour, the Lib Dems and UKIP resigned. And then one of them unresigned. 87. He promised he would not gloat about Jeremy Corbyn 88. And even gave him some advice on how to win the contest. Mr Cameron told him he should copy his own tactics against David Davis - and position himself as the ""change candidate"". 89. But the PM managed to blank the girl who started the ""Milifandom"" during the election campaign. Abby Tomlinson wrote on Twitter: ""Help me. I think he knows who I am. He kept staring after I said hello."" 90. He has had a row with Sir John Chilcot about when the Iraq inquiry will be published... Cameron marked 100 days taking about his ""One Nation vision"" 91. And lost a Lord to drugs and prostitution. 92. Mr Cameron has announced a levy on large firms to pay for apprenticeships... 93. An 8% surcharge on bank profits... 94. And committed to spending 2% of GDP on defence for the rest of this Parliament. 95. He has axed student maintenance grants. 96. Ruled out a sugar tax. 97. And scrapped housing benefit for 18 to 21-year-olds. 98. Mr Cameron has also written an article about 100 days in government. 99. How is he marking it? By committing to more academies and saying the wants every school to have the opportunity to convert. 100. According to the PM himself: ""100 days in, we are showing it is a Conservative majority government which has the ideas to build the One Nation vision and to deliver real social mobility in our country."" In other words, he is trying to park his tanks on Labour's territory."
2015-08-15,"A 40ft-deep hole in the road has opened up on Manchester's Mancunian Way, shutting a major route around the city centre.",https://web.archive.org/https://web.archive.org//web/20150815113448/http://news.sky.com/story/1535895/huge-hole-shuts-major-road-in-manchester,"A 40ft-deep hole in the road has opened up on Manchester's Mancunian Way, shutting a major route around the city centre. The road is closed in both directions, according to Transport for Greater Manchester - which is warning of delays and advising people to take alternative routes. The hole is at the eastern end of the road, between the junctions of the A6 London Road and Fairfield Street. It opened up after midday on Friday and a workman told the Manchester Evening News there were concerns it could spread to the other side of the carriageway. The city has been lashed by heavy rain today, and Mancunian Way was earlier closed due to flooding. The rain has also caused delays on the city's trains. In a statement, Manchester City Council said: ""Motorists should be aware that part of the Mancunian Way is currently closed in both directions due to a collapse in the road caused by the extremely wet weather. ""It is thought a culvert beneath the Mancunian Way has been eroded by the heavy rainfall which has caused the road above to be impacted. ""City council and United Utilities officers are currently at the scene to assess the situation. ""Depending on the extent of the issue the road may remain closed over the weekend. ""Traffic will be diverted via London Road, Fairfield Street, A665, Hyde Road and Downing Street."" Football fans heading to Manchester City's game against Chelsea on Sunday are being warned to check on the latest situation before they travel."
