date,program,link,transcript
2014-09-24,MPs Sob At 'Keep Your Mitts Off My NHS' Speech,https://web.archive.org/https://web.archive.org//web/20140924200410/http://news.sky.com/story/1341399/mps-sob-at-keep-your-mitts-off-my-nhs-speech,"A 91-year-old Second World War veteran has upstaged Ed Miliband at the Labour Party conference with a passionate and tear-jerking speech on the health service. 
	Harry Smith moved audience members to tears as he made a passionate case for the NHS and warned David Cameron: ""Keep your mitts off my NHS."" 
	Mr Smith received a number of standing ovations as he detailed his life in a ""barbarous, bleak and uncivilised"" Barnsley slum where he listened to the screams of a woman dying of cancer because she could not afford the medicine to dull the pain. 
	His eight-minute speech came after a poorly received 66-minute keynote by the Labour leader on Tuesday, which was roundly condemned after it emerged he forgot to mention the deficit. 
	Political pundits were hailing Mr Smith's speech as a lesson to Mr Miliband in delivery, saying he had managed to make a powerful case for the NHS in a way the leader had failed to. 
	Steve Hawkes, deputy political editor, of the Sun, tweeted: ""91 year-old Harry Smith shows Ed Miliband how to do it - rousing speech (from autocue) that gets delegates on their feet."" 
	Another Twitter user, Robert Bennett, wrote: ""Harry Smith 91 years didn't forget any of his speech."" 
	While another, Mark Robinson, tweeted: ""Such a contrast between Harry Smith's speech and Ed Miliband's."" 
	Labour politicians, including the shadow health secretary Andy Burnham, wept openly as he described how his sister had to be buried in a paupers' pit after dying of tuberculosis at the age of 10. 
	He said the family watched as she faded away, unable to help because they ""just didn't have the dosh to keep her comfortable"". 
	Mr Smith said that eventually she was sent to die in a workhouse infirmary because her mother could no longer care for her. 
	Mr Smith told the conference: ""In my heart, I can still feel my mum and dad's desperation as they were trying to keep our family safe and healthy in the slum we called home. 
	""Common disease controlled our neighbourhood and snuffed out life like a cold breath on a warm candlelit flame."" 
	He said he was born in 1923 to a life that was nothing like an episode of Downton Abbey, where hospitals and doctors were for the privileged few. 
	But he said while his heart was with the children of his generation who did not make it, it was also with the people of the present who were struggling because of welfare cuts and austerity measures. 
	He finished: ""Today we must be vigilant. We must never ever let the NHS free from our grasp because if we do, your future will be my past. 
	""My life is your history and we should keep it that way. 
	""So say it loud and say in clear in this hall and across this country, Mr Cameron, keep your mitts off my NHS."""
2014-09-24,'Racist' Exhibition Closes Amid Boycott Calls,https://web.archive.org/https://web.archive.org//web/20140924200410/http://news.sky.com/story/1341656/racist-exhibition-closes-amid-boycott-calls,"By Afua Hirsch, Social Affairs Editor An international exhibition depicting a ""human zoo"" has been forced to close after heated protests. 
	""Exhibit B"", a live installation by white South African artist Brett Bailey, features black actors shackled and chained in cages and claims to explore the legacy of slavery and racial oppression. 
	But after a petition against the show attracted almost 23,000 signatures online, it was finally forced to close on its opening night in London, amid claims it is racist. 
	""We are protesting against this exhibition because it's fundamentally racist and it's disrespectful to the memory of our ancestors, and the great pain and suffering they went through to this day,"" said Sara Myers, who organised the protest and the petition. 
	""You don't challenge racism by creating racism. I think it's deeply disturbing that to look at the atrocities of colonialism, you need to go back and look at black people in chains, with tape measures around their heads. There are better ways of doing that."" 
	Mr Bailey did not want to speak to Sky News, but his exhibition has been defended by the Barbican, which was hosting the show in London. 
	In a statement, it wrote: ""Last night, as Exhibit B was opening at the Vaults, it became impossible for us to continue with the show because of the extreme nature of the protest and the serious threat to the safety of performers, audiences and staff. 
	""We find it profoundly troubling that such methods have been used to silence artists and performers, and that audiences have been denied the opportunity to see this important work. 
	""Exhibit B raises, in a serious and responsible manner, issues about racism. It has previously been shown in 12 cities, involved 150 performers and been seen by around 25,000 people with responses from participants, audiences and critics alike being overwhelmingly positive."" 
	But one dancer, who appeared in the exhibition in Paris, said she could understand the anger of anti-racism campaigners. 
	""White people can put on an exhibition like this, but when we – whose ancestors experienced the suffering of slavery, colonialism and racism – want to tell our story, curators do not want to run it,"" said Chantal Loial, a choreographer and dancer who performs an ode to 18th century slave and ""freak show"" exhibition Saartjie Baartman, who is also known as Hottentot Venus. 
	""They say we are not distant enough to do something like this. And black people, they are really fed up with this."""
2014-09-24,Freed Abu Qatada 'Will Not Be Returning To UK',https://web.archive.org/https://web.archive.org//web/20140924200410/http://news.sky.com/story/1341176/freed-abu-qatada-will-not-be-returning-to-uk,"Home Secretary Theresa May has insisted Abu Qatada will not be returning to the UK, as the preacher was pictured falling to the floor in an emotional reunion with supporters. 
	The radical preacher was facing charges over the so-called ""millennium plot"" to bomb Western tourists during New Year celebrations in Jordan. 
	But the 53-year-old is now starting a new life as a free man after the judge decided there was not enough evidence to convict him. 
	Abu Qatada was deported from the UK last year following a long-running battle by the Home Office which cost millions of pounds. 
	The Palestinian-Jordanian preacher was once referred to as ""Osama Bin Laden's right-hand man in Europe"" by a Spanish judge. 
	Home Secretary Theresa May said it was still the right decision to deport him. 
	She said: ""The UK courts here were very clear that Abu Qatada posed a threat to our national security. That's why we we were pleased, as a Government, to be able to remove him. 
	""He is subject to a deportation order. He is also subject to a UN-travel ban - that means he will not be returning to the UK."" 
	Sky's Tom Rayner, at the trial in Amman, said Abu Qatada seemed to be expecting the verdict and gave a ""wink and a kind of smile"" to his family when he stepped into the caged dock. 
	The preacher's supporters were in raptures, with family members in tears when the judge handed down his verdict in the Jordanian capital. 
	Abu Qatada had already been acquitted in June over a series of 1998 bomb plots. 
	The cleric had previously been convicted and sentenced on both charges by a trial in absentia, but had avoided Jordanian justice after getting asylum in the UK. 
	He lost his refugee status in 2002 when he was detained on suspicion of terrorism offences, and was held in indefinite detention at high-security prisons, such as Belmarsh, but never stood trial. 
	Abu Qatada was eventually thrown out of the country in July 2013 after a high-profile campaign by the Government, which argued he was a threat to national security. 
	It came after a ""memorandum of understanding"" between the UK and Jordan assured he would receive a fair trial. 
	The agreement stipulated that although he would be tried in a military-security court, the case would be heard by a civilian judge. 
	Crucially, it also said that evidence which may have been acquired through torture would not be eligible in the case. 
	With that guarantee in place, Tom Rayner added ""the judge said there simply wasn't enough evidence to convict him"". 
	He said: ""The real question is what he will do here in Jordan. He is a renowned jihadist figure, he is a known al Qaeda sympathiser."" 
	Rayner added that Abu Qatada's criticism of Islamic State could ironically make him a ""stabilising force"" within the country in case extremists were thinking of a backlash over the country's support for US airstrikes."
2014-09-24,What Now For Abu Qatada After Aquittal?,https://web.archive.org/https://web.archive.org//web/20140924200410/http://news.sky.com/story/1341570/what-now-for-abu-qatada-after-aquittal,"By Tom Rayner, Middle East Reporter, in Amman, Jordan Only a man sure he was on the verge of freedom would smile walking into a cage, flanked by armed police in a high-security court. 
	Abu Qatada exuded confidence from behind the bars of the dock. 
	It took only a few minutes for the judge to read out the verdict. 
	He said there was simply not enough evidence for a conviction on involvement in a plan to attack Israeli and western tourists during millennium celebrations. 
	Having been cleared in June of another charge related to alleged bomb plot in 1998, the man once dubbed ""Bin Laden's right-hand man in Europe"" was cleared of all the accusations he had been convicted of in absentia 14 years ago. 
	The Home Office was quick to say that Abu Qatada would not be able to return to Britain, regardless of the verdict, but it's not entirely clear that he would want to, even if he was able to. 
	Qatada's battle against extradition was always grounded on the claim that he would not receive a fair trial in Jordan. 
	His lawyers insisted the testimonies that formed the evidence against him were obtained under torture. 
	The agreement that no such testimonies would be used in his retrial was key to his deportation last year. 
	Now the trial has taken place and his acquittal secured, there are many reasons why Abu Qatada may be content to stay in Jordan. 
	Key among them is the rise of Islamic State - a crisis that Abu Qatada may feel he can influence most effectively from the region. 
	As he left court, journalists mobbed him. 
	Desperate to get his response not just to his acquittal, but to get his view on the airstrikes against IS – the group whose behaviour he has already denounced as counter to Islam. 
	It's clear, perhaps because of his notoriety, Abu Qatada remains one of the world's most influential jihadist thinkers. 
	""I don't think Abu Qatada is involved in terrorist organisations, otherwise he'd have been found guilty,"" said his friend, Jordanian analyst of jihadi movements, Marwan Shehadeh. 
	""But he's one of the main mentors for jihadist groups – and he's a Sheikh, a scholar of sharia law, and so he gives fatwas in relation to jihad."" 
	Shehadeh believes the rise of Islamic State has divided global jihadist thinking, and added: ""There are two wings – one is represented by (Jordanian jihadist Abu Musab al) Zarqawi, which is now Islamic State, the other is the views of Bin Laden, which is al Qaeda. 
	""I think Abu Qatada is more supportive of al Qaeda than IS. He judges the actions by looking to sharia law, and makes fatwas based on that."" 
	But Shehadeh also warned regional governments not to count on Qatada's condemnation of Islamic State, neutering the potential for a backlash in their own countries. 
	He said: ""Of course he is against the alliance – the campaign to target IS, al Nusra and other factions ... I think soon he will release statement against the alliance and the airstrikes."" 
	Many are already watching how Abu Qatada uses his new freedom."
2014-09-24,iPods Save 750 Lives During Hospital Trials,https://web.archive.org/https://web.archive.org//web/20140924200410/http://news.sky.com/story/1340999/ipods-save-750-lives-during-hospital-trials,"By Lisa Dowd, Sky Correspondent The lives of more than 750 patients have been saved at two hospitals after nurses started using iPods instead of paper charts to record patients' vital signs. 
	Research published in the British Medical Journal found that in one year the number of deaths at Queen Alexandra Hospital in Portsmouth fell by 397 following the introduction of the new system. 
	At University Hospital Coventry 372 fewer patients died. The system has been trialled at the West Midlands hospital since 2007. 
	The special software automatically calculates if a patient is deteriorating and sends out alerts. 
	Staff have found the system is cutting down mistakes and saving time. 
	Nurse Amy-Dawn Lees uses an iPod to record a patient's blood pressure, heart rate, oxygen levels and temperature, as well as tapping in how a patient is feeling. 
	""The old paper charts were very, very difficult to decipher; the crosses, the arrows, written on the chart by the previous nurse. You can't actually distinguish exactly where the cross is,"" said Ms Lees. 
	""On the new electronic charts everything is colour-coded, you are able to see the previous observations in more detail, more accurately and obviously able to see whether your patient is the same, better or worse."" 
	Data from each iPod goes into a central computer system, which doctors, nurses and managers can access. 
	Patients across all wards are given a score of between 0 and 21. 
	""We have patients in today with high scores varying from 6, where we're starting to be concerned, to 11, which is the sickest patient we have,"" said Dr Duncan Watson, Clinical Director of Critical Care at University Hospital. 
	Doctors and nurses are also alerted to patients' needs by colour codes. Red signifies patients who need the most attention. 
	""It's radically changed things for us,"" added Dr Watson. 
	""It has decreased the mortality rates for the hospital, we are able to identify 10 patients a week and prevent them coming into the intensive care units, we can decrease their length of stay and the patients actually do better as they don't get as sick and we identify them quicker."" 
	The system is expensive, according to Dr Watson - but it has the potential to save money long-term. 
	More importantly, across the two hospitals death rates have fallen by 15%. 
	Most hospital trusts still use a paper system, but University Hospital is now almost paper-free."
2014-09-24,Fact Check: Do Ed Miliband's Claims Stack Up?,https://web.archive.org/https://web.archive.org//web/20140924200410/http://news.sky.com/story/1340974/fact-check-do-ed-milibands-claims-stack-up,"Ed Miliband has set out his six goals for Britain's future in his speech to the Labour conference. So how do some of his claims fare under closer scrutiny? 
:: Claim One: The number of apprenticeships for young people has fallen under the current government 
	This is true for young people under 19. The number starting apprenticeships fell from 129,900 in the 2011/12 academic year to 114,500 in the 2012/13 academic year. The apparent small fall from the previous year is possibly due to a minor change in the way they were counted. 
	Apprenticeship starts for those aged 19-24 and 25 upwards increased between 2010/11 and 2011/12 before remaining at a similar level in 2012/13, with the biggest increase among those aged over 25. 
	The Institute for Public Policy Research has suggested the increase could be due in part to companies shifting their employees onto apprenticeships in order to access government funding. 
Claim Two: Wages rising slower than prices for 50 out of 51 months 
	There are all sorts of ways to measure the ""cost of living"" but one of the most common is to compare the rises in prices and wages. 
	Real wages - wages adjusted for prices - have been falling since 2008 as price rises have outstripped wage increases. 
	This measure alone is limited: it doesn't say anything about how household incomes have changed - this includes, for instance, the effects of tax and benefit changes. 
	The Institute for Fiscal Studies calculates the median income fell by 5.8% between 2009-10 and 2012-13. 
Claim Three: Housebuilding is at its lowest since the 1920s 
	This is correct, apart from housebuilding during Second World War, according to figures for England and Wales. 
	Ed Miliband said a Labour government would aim to double the number of first-time buyers who get on the housing ladder each year by 2025. 
	Historical data to 2010 suggests the number of first-time buyers is at a fairly low level, with about 200,000 loans given to first-time buyers in 2010. 
	This excludes those buying a house outright for the first time, without a mortgage. 
	More recent data from the Council of Mortgage Lenders suggests the figure has been increasing, with first-time buyer loans in June 2014 up 18% on the same time in 2013, but there is no annual data available to compare back. 
Claim Four: Britain is behind Germany, Japan, the US, India and China for low-carbon green technologies and services. 
	According to government figures, in 2011/12 the UK was ranked sixth globally overall for its low carbon and environmental goods and services sector, with the US, China, Japan, India and Germany making up the top five. 
	So although this claim seems to be correct, these are the only countries that the UK is behind. 
	The UK's green goods and services market was valued at just over £128bn in 2011/12, £17bn less than Germany but around £24bn more than France (which was 7th). 
Claim Five: One in five workers finds themselves on low pay 
	The average UK worker earns about £11.62 an hour, and just over 20% earn less than two-thirds of that (£7.75), often defined as ""low pay"". 
	This is very close to the Living Wage currently set at £7.65 nationally (apart from a higher rate for London). 
	Just over five million people in the UK earn the Living Wage or less; again close to one in five of all UK workers. 
	The Minimum Wage represents lower pay still. Ed Miliband has pledged this will rise to £8 by 2020 under a Labour government. 
	This is likely to be a real-terms increase if inflation continues at current levels. For the last few years, the Minimum Wage has increased by less than inflation. 
Claim Six: One in four people have to wait a week or more for a GP appointment. 
	The latest survey for NHS England shows 14% of those who tried to see or speak to someone at their GP surgery got an appointment a week or more after they phoned up, while 11% didn't get one at all. 
	But not everybody wanted an appointment straight away - 14% of patients didn't have a particular day in mind for an appointment, and 6% wanted an appointment a week or more later."
2014-09-24,Tesco Profit Error: Could Something Be Amiss?,https://web.archive.org/https://web.archive.org//web/20140924200410/http://news.sky.com/story/1340272/tesco-profit-error-could-something-be-amiss,"By Ian King, Business Presenter Even from a lesser company, three profits warnings inside a year would be startling. 
	Coming from a blue-chip stalwart like Tesco, it is nothing short of astonishing. 
	In issuing a profits warning on top of a profits warning, Britain's biggest food retailer almost seems to be taking to an extreme the strategy so commonly seen in its stores, with three for the price of two. 
	So what exactly has Dave Lewis, the new chief executive, uncovered? 
	Well, in its own words, Tesco has identified an overstatement of its expected profit for the half-year, principally due to the accelerated recognition of commercial income and delayed accrual of costs. 
	In other words, the reporting of costs incurred in the first half of the year appears to have been delayed so they are pushed into the second half, while profits enjoyed during the second half of the year appear to have been brought forward into the first half. 
	It is unclear what kind of activities generated these profits, but commercial income, with regard to supermarkets, could mean rebates from third-party suppliers or payments from those suppliers to incentivise Tesco to give their goods better positions when they are displayed in its stores. 
	This latter practice is common place in the supermarket sector and, having worked previously at Unilever, Mr Lewis will be familiar with it. 
	The overall effect of these two actions will have been to pretty-up Tesco's first-half numbers. 
	Cynics will suggest Mr Lewis has every reason to restate the numbers lower - after all, the period, the six months to August 23, was when his predecessor, Philip Clarke, was at the helm. 
	Some would say it is in Mr Lewis' interests to ensure that period is painted in as bad a light as possible in order to make any subsequent turnaround under him look better. 
	It's known as ""kitchen sinking"" in the City - where every possible bad bit of news, including the proverbial kitchen sink, is thrown into the accounts to make them look bad. 
	But the sheer size of this overstatement, £250m, would suggest this is a bit more serious. 
	So is Mr Lewis' response: the suspension of four of Tesco's UK executives, his recruitment of the top City lawyers Freshfields to investigate and his hiring of outside auditors from Deloitte - Tesco's regular auditor is PwC - to examine what has happened. 
	At this time, there is no suggestion that anything illegal has been happening. After all, all businesses occasionally recognise revenues early or take their time to recognise costs in the accounts. 
	Yet the sheer aggression of the accounting policy in this instance and Mr Lewis' response to discovering it rather suggests he thinks something may be amiss. 
	And, with plenty of American investors - who tend to be more litigious than their European counterparts - on Tesco's shareholder base,  he is doing the prudent thing in checking this out as thoroughly as possible."
2014-09-24,Labour's Struggle With Big Figures Of The Past,https://web.archive.org/https://web.archive.org//web/20140924200410/http://news.sky.com/story/1340240/labours-struggle-with-big-figures-of-the-past,"Ed Balls made considerable play in his conference speech of the need for Labour to confront past failings as well as trumpet successes. 
	But it feels as though some parts of Labour history are still no-go areas. 
	In particular, one would almost think there is a conspiracy of silence when it comes to the two most dominant figures of recent Labour history - Tony Blair and Gordon Brown. 
	Nobody in Manchester wants to talk about Tony Blair. Since this conference hall played host to his farewell speech as Labour leader, he has been an ever-absent at party gatherings. 
	Perhaps more surprising given his recent success in Scotland is the reluctance to give Gordon Brown his due. 
	Ed Miliband, in an impromptu speech to the hall, thanked all and sundry involved in the Labour campaign, from Alistair Darling to Johann Lamont and Anas Sarwar, and yet neglected to mention the man that some are crediting with saving the Union. 
	It leaves one with the sense that in Labour's hurry to move on and look to the future, it can at times seem as though the party is afraid of grappling with the big figures of its past."
