date,program,link,transcript
2014-09-26,Iraq Airstrikes Could Happen Within Hours,https://web.archive.org/https://web.archive.org//web/20140926190931/http://news.sky.com/story/1341979/airstrikes-could-happen-minutes-after-vote,"In theory, British airstrikes on Iraq could have started within minutes of parliamentary approval. 
	Realistically, RAF Tornados will be in the skies in the very early hours of Saturday morning, at the earliest. 
	They will deploy in pairs, taking off over Akrotiri Bay and climbing northeast over the Mediterranean and towards the Turkish coast. 
	The butterflies of anticipation will be churning away inside, they will be aware of the television cameras at the end of the runway, they will know that within a few hours, as dawn breaks, they will be headline news. 
	Hugging the Turkish border with Syria at 25,000 feet, the jets will meet an RAF Voyager refuelling aircraft en route, before dropping down into northern Iraq. 
	Flying at 400mph (643kph), they will reach the theatre of operations within a short time. 
	What happens next is a decision for US Centcom, which is co-ordinating the overall operation. 
	The jets might fit into a holding pattern to perform an ""x-cas"" role, the military acronym for ""emergency close air support"". 
	Because this isn't a traditional conflict against a rogue state, there will be fewer major installations to destroy. 
	The coalition wants to destroy Islamic State, they don't want to destroy Iraq. 
	The Tornados, one of the best ground-attack aircraft in the world, will be fully loaded with the equipment specific to the task they've been given. 
	A Litening III pod will be attached underneath. This gives the crew the ability to examine the immediate area and then laser-designate the target. 
	The final decision to fire will be down to the pilot himself. 
	The payload will probably be four Paveway bombs and two Brimstone missiles. 
	Paveways can be programmed by the crew to explode just before it hits the target, or on impact or with a small delay so it can bury into a building. 
	The Brimstone locks on to its target the moment it is fired. It is a ""fire-and-forget"" weapon, meaning that it can be used in all weathers and at distance from the target. 
	Designed especially for armoured vehicles or similar, a small warhead explodes first to soften up the armour before a larger warhead detonates creating more destruction. 
	For the British, this will be a twin-pronged operation: from sea and air. A Royal Naval submarine is also moving into position. 
	Her exact identity and location is top secret but she's most likely in the eastern Mediterranean. 
	She carries Tomahawk cruise missiles - TLAMs - which have a range of about 1,000 miles (1,600km). 
	Guided by GPS, these are effective against static objects: buildings, military installations, weapons dumps and oil refineries. 
	The submarine can also watch live images from a camera on the TLAM as it flies over the battlefield and strikes its target. 
	Job done, the crew will turn for home. Landing back in Cyprus, the news will just be breaking. 
	Within hours, footage recorded on board the aircraft will be released to the media to be broadcast and analysed on 24-hour news channels around the world. 
	As the crews eat some food and get some sleep, another team will be getting ready for their mission, ready to fly at a moment's notice."
2014-09-26,UK To Strike Iraq - But Is Syria The Real Target?,https://web.archive.org/https://web.archive.org//web/20140926190931/http://news.sky.com/story/1341770/uk-to-strike-iraq-but-is-syria-the-real-target,"This week in New York has given David Cameron what he's needed. A platform and a justification to bring British airpower to the fight against the Islamic State. 
	There was palpable relief in the delegation travelling with the Prime Minister when I interviewed him earlier. Britain can now play a more aggressive role in the coalition its special relationship partner is building. 
	And the Prime Minister seems confident he will not suffer another embarrassing debacle in parliament. Ed Miliband has much to lose if he opposes him. But there is an inconsistency in Britain's role and clear limits on its intervention. 
	In his speech to the UN General Assembly David Cameron spoke of specific atrocities IS has carried out in Syria, the slaughter of 700 tribesmen for instance in the east of the country, and he talked of the dangers of inaction. 
	But Britain will not be striking IS in Syria. It will only target the organisation in Iraq. What remains to be hit there and remains exposed for further airstrikes is not clear.  
	IS strongholds are in Syria and any effort to destroy it, the clear endgame for both the US and UK, will require attacking it there. 
	The Prime Minister is not confident about either the legality of airstrikes in Syria or the chances of persuading MPs to support the idea. 
	So if the Prime Minister is able to win support for intervention on Friday, which seems likely, Britain joins the air campaign late and in a limited role. 
	Any expansion of that across the border into Syria will need another debate in parliament. The Prime Minister's adamant about that."
2014-09-26,What Now For Abu Qatada After Aquittal?,https://web.archive.org/https://web.archive.org//web/20140926190931/http://news.sky.com/story/1341570/what-now-for-abu-qatada-after-aquittal,"By Tom Rayner, Middle East Reporter, in Amman, Jordan Only a man sure he was on the verge of freedom would smile walking into a cage, flanked by armed police in a high-security court. 
	Abu Qatada exuded confidence from behind the bars of the dock. 
	It took only a few minutes for the judge to read out the verdict. 
	He said there was simply not enough evidence for a conviction on involvement in a plan to attack Israeli and western tourists during millennium celebrations. 
	Having been cleared in June of another charge related to alleged bomb plot in 1998, the man once dubbed ""Bin Laden's right-hand man in Europe"" was cleared of all the accusations he had been convicted of in absentia 14 years ago. 
	The Home Office was quick to say that Abu Qatada would not be able to return to Britain, regardless of the verdict, but it's not entirely clear that he would want to, even if he was able to. 
	Qatada's battle against extradition was always grounded on the claim that he would not receive a fair trial in Jordan. 
	His lawyers insisted the testimonies that formed the evidence against him were obtained under torture. 
	The agreement that no such testimonies would be used in his retrial was key to his deportation last year. 
	Now the trial has taken place and his acquittal secured, there are many reasons why Abu Qatada may be content to stay in Jordan. 
	Key among them is the rise of Islamic State - a crisis that Abu Qatada may feel he can influence most effectively from the region. 
	As he left court, journalists mobbed him. 
	Desperate to get his response not just to his acquittal, but to get his view on the airstrikes against IS – the group whose behaviour he has already denounced as counter to Islam. 
	It's clear, perhaps because of his notoriety, Abu Qatada remains one of the world's most influential jihadist thinkers. 
	""I don't think Abu Qatada is involved in terrorist organisations, otherwise he'd have been found guilty,"" said his friend, Jordanian analyst of jihadi movements, Marwan Shehadeh. 
	""But he's one of the main mentors for jihadist groups – and he's a Sheikh, a scholar of sharia law, and so he gives fatwas in relation to jihad."" 
	Shehadeh believes the rise of Islamic State has divided global jihadist thinking, and added: ""There are two wings – one is represented by (Jordanian jihadist Abu Musab al) Zarqawi, which is now Islamic State, the other is the views of Bin Laden, which is al Qaeda. 
	""I think Abu Qatada is more supportive of al Qaeda than IS. He judges the actions by looking to sharia law, and makes fatwas based on that."" 
	But Shehadeh also warned regional governments not to count on Qatada's condemnation of Islamic State, neutering the potential for a backlash in their own countries. 
	He said: ""Of course he is against the alliance – the campaign to target IS, al Nusra and other factions ... I think soon he will release statement against the alliance and the airstrikes."" 
	Many are already watching how Abu Qatada uses his new freedom."
2014-09-26,Rogue Wedding DJ Jailed Over Death Scam,https://web.archive.org/https://web.archive.org//web/20140926190931/http://news.sky.com/story/1342786/rogue-wedding-dj-jailed-over-death-scam,"A DJ has been jailed for six months after cancelling wedding bookings at the last minute by falsely claiming his father had died. 
	Michael Stockman, 31, of Coleraine, Co Londonderry, was convicted of 12 counts of theft and ordered to pay £1,200 in compensation. 
	District Judge Liam McNally said: ""You have lied in relation to the reasons that the contracts were cancelled and you have not paid back one penny. 
	""Had you acknowledged your guilt and shown some remorse I would have suspended the sentence."" 
	Coleraine Magistrates Court heard how, during 2012 and 2013, Stockman made 11th-hour cancellations for weddings, birthday and leaving parties booked through his company North West Discos. 
	His charges had ranged from £40 for a birthday party to £300 received in two instalments for a wedding. 
	District Judge McNally said: ""You allowed people to enter into contracts for a DJ service for important events in their lives such as weddings. 
	""Either the night before or that night they were cancelled with an entirely untruthful excuse causing a great deal of trauma to those people who had paid you for the service."" 
	Stockman used the death of his father as an excuse on three occasions and, on six further occasions, said the DJ he had subcontracted the party to had been injured in a car crash. 
	He claimed to have signed his business over to someone else in 2012 but the judge dismissed the excuse as a ""ruse"". 
	Speaking in his defence, a tattooed Stockman told the court his life had taken a disastrous turn after he was attacked in May of that year. 
	Stockman said: ""I had my nose bitten off my face in an unprovoked attack. I had 13 stitches. Ever since that day my life has been upside down."" 
	He later added: ""At that time my head was all over the place not only with mental issues. That first years was like a blank canvass I could not believe half the things that have even happened here."" 
	After the sentencing, Moira Todd, from the Trading Standards Service, said: ""His actions were cruel and had the potential to ruin what should be the best day of people's lives. 
	""He made no apology to anyone and totally ignored requests for refunds."" 
	Stockman plans to appeal."
2014-09-26,Child In Newcastle Pond Tragedy Named,https://web.archive.org/https://web.archive.org//web/20140926190931/http://news.sky.com/story/1342547/child-in-newcastle-pond-tragedy-named,"A three-year-old boy who died after falling into a pond in Newcastle has been named as Callum Greenwood. 
	The little boy was found 10 minutes after he was reported missing on Thursday evening but was later pronounced dead at the Royal Victoria Infirmary. 
	A neighbour who saw emergency services' frantic efforts to save Callum said he realised at once something terrible had happened. 
	Plasterer Paul Taylor, 37, who lives next door, said: ""I'd been out to get an Indian and when I came back there was a massive police search on. 
	""They had closed off the road and the ambulance was there. 
	""I saw somebody in a blanket being carried into the ambulance. 
	""I thought obviously something terrible had happened but I didn't know what."" 
	He added: ""It's hard to believe this has happened to someone of that age."" 
	His partner, Emma Taylor, 38, said: ""We could see people crying and screaming. A woman was hysterical. 
	""When we saw someone being bundled into the ambulance, we still didn't know. 
	""The people next door are very private. We have since heard the boy was their daughter's child, who had come for a visit."" 
	Two Police Community Support Officers were seen standing outside the large detached property in Elswick Road where the little boy was last seen. 
	Northumbria Police's Superintendent Mick Paterson said on Thursday night: ""This is an incredibly tragic incident and our thoughts are with the family at this difficult time. 
	""They are understandably absolutely devastated and officers with specialist training are providing them with support."" 
	A report is being prepared for the coroner."
2014-09-26,Fathers Of Iraq War Dead Split Over Raids,https://web.archive.org/https://web.archive.org//web/20140926190931/http://news.sky.com/story/1342303/fathers-of-iraq-war-dead-split-over-raids,"By David Bowden, Senior Correspondent Few are better equipped to have an opinion on the wisdom or otherwise of sending British troops into action again in Iraq, than John Miller and John Hyde. 
	Both lost a son during the last Iraq war. 
	Both live with the consequences every day, trying to find answers, trying to stay strong for their families and particularly their wives, Marilyn and Sandra, who struggle, even now with losing their boys. 
	Corporal Simon Miller, 21, and Lance Corporal Ben Hyde, 23, were two of the six Red Caps, Royal Military Police, brutally killed by an angry mob in Majar al Kabir in southern Iraq on 24 June 2003. 
	Despite sharing such devastating losses in the fight to topple Saddam Hussein more than a decade ago, the two Johns have opposing views today on whether UK forces should intervene once again in the fate of Iraq. 
	Sitting in his spotless kitchen in Washington, Tyne and Wear, watched over by a poster-sized photograph of his fallen son, John Miller told me RAF airstrikes would only ""fuel the fire"" of extremists planning terrorist atrocities. 
	He says the UK and America should leave Arab states to take the lead on military intervention. 
	""We look at how the Arab world sees the Western world, particularly Britain and America, over what happened in Iraq and it's only fuelling the fire. It's a recruiting programme. 
	""The securest thing for our countries would be not to be involved and it will not give them any reason to want to commit a terrorist attack in our country."" 
	Mr Miller believes we have already opened what he calls ""Pandora's box"" in the Middle East and we will never be able to close it again. 
	He fears his son Simon and all those other British soldiers who have given their lives in Iraq and Afghanistan may have died in vain. 
	Islamic State and their brothers in arms, he says, are the consequence of the West's folly and further involvement will bring further UK casualties. 
	""I for one do not want to see another coffin draped in the Union Jack coming back to Brize Norton (RAF Airforce base), somebody else's family ruined for the rest of their lives for something we can't and never will be able to solve."" 
	An hour down the road in Northallerton, North Yorkshire, John Hyde is more measured in his assessment of the prospect of UK airstrikes. 
	He speaks quietly because his wife Sandra has already gone to bed. It's only 8.30pm , but she finds any media discussion of Ben too harrowing to face. 
	He is in favour of any assistance the UK can offer in Iraq with the exception of ""boots on the ground"". 
	""Anything short of that we should give,"" he says. 
	""Training troops, advice, air support, anything we can give, because in the end the outcome must be positive. 
	""It's an international problem and I think it is something the international community should solve."" 
	Mr Hyde channels much of his energy into running a memorial trust in honour of Ben, which has so far raised more than £100,000. 
	He often doesn't go to bed until 4am because he's working on his computer. 
	The screensaver - a picture of his dead son in his dress uniform. 
	There is no shortage of other memorabilia too; a sequence of pictures of Ben as a young boy, a commemorative certificate signed by the Queen and even a small wooden box with a brass plaque containing Ben's DNA, which had been held by the Ministry of Defence. 
	The Millers' home also proudly displays mementos of their son, Simon, who died for Queen and Country and who fills their thoughts every single day. 
	The Millers and the Hydes are just two of the hundreds of families of fallen soldiers who have given their lives fighting Britain's wars in the past decade. 
	Doubtless every single one of them will have their own views on whether more UK forces should put themselves in harm's way this time around."
2014-09-26,Ofgem Warns Energy Firms Over Complaints,https://web.archive.org/https://web.archive.org//web/20140926190931/http://news.sky.com/story/1342598/ofgem-warns-energy-firms-over-complaints,"The energy regulator has written to providers demanding action on how they handle customer complaints over bills and service. 
	Ofgem said more than half of consumers told a survey they were not satisfied with the so-called big six energy providers' complaints processes. 
	According to Ofgem, despite claims that the firms were improving service, complaints were continuing to rise. 
	It said a survey showed 57% of domestic and 52% of small business consumers were not satisfied with the way their complaint had been handled by their energy supplier. 
	Furthermore, in nearly half of cases where the supplier considered the case resolved, the customer did not. 
	It said satisfaction with npower and Scottish Power had fallen markedly, with only SSE managing to maintain levels of satisfaction found two years ago. 
	Ofgem chief executive Dermot Nolan said: ""These satisfaction scores are frankly awful. Almost all energy suppliers need to improve their complaints handling as a matter of urgency. 
	""There are real business benefits to good complaints handling schemes, and it shouldn't need a regulator to tell companies about the importance of this. 
	""Suppliers must now tell their customers what steps they will be taking to put things right."" 
	Mr Nolan said Ofgem was investigating npower over its spiralling complaints and warned it would ""take action"" against others if need be. 
	The big providers have been under fire for almost a year following a succession of above-inflation price hike announcements. 
	Earlier this month the six firms launched a campaign to reunite former customers with £153m of unclaimed credit on accounts, following a demand from Ofgem. 
	Although the big six firms - British Gas, npower, EDF, Scottish Power, SSE and E.On - are still the dominant providers in Britain, their market share is leaching to smaller independents. 
	A study by Cornwall Energy found that while they still control 92.4% of the market, it is down from 99.8% five years ago. 
	The Competition and Markets Authority has since launched an investigation into the structural nature of the energy sector, where companies can generate power and then sell it on at a profit to their residential arms."
2014-09-26,Victoria Beckham Speaks At United Nations,https://web.archive.org/https://web.archive.org//web/20140926190931/http://news.sky.com/story/1342141/victoria-beckham-speaks-at-united-nations,"Victoria Beckham spoke of her ""responsibilities as a woman and a mother"" after being named as a Goodwill Ambassador for the United Nations. 
	Posh Spice is following in the footsteps of Nicole Kidman, Angelina Jolie, Emma Watson, former bandmate Geri Halliwell and husband David in becoming an ambassador. 
	She will work with UNAIDS, the UN's HIV and Aids charity. 
	""It's taken me getting to 40 to realise I have a responsibility as a woman and a mother,"" said the singer-turned-designer. 
	""I recently visited South Africa and was so touched by the women I met. I felt inspired and I came home and knew I had to do something. 
	""I'm going to speak on behalf of the incredible women and the incredible charities who are working so desperately hard in these countries. I'm going to lend my voice to them because for some reason people listen to me. 
	""I need to use what I have to make a difference."" 
	The former Spice Girl missed the opening of her new London store to speak at the UN in New York - sending her husband David in her place. 
	She told reporters she still had lots to learn about what UNAIDS does. 
	""I'm not going to sit here and pretend to know everything right now, I don't. I'm learning, I have people mentoring me. I'm going back to South Africa in a few weeks and further afield next year,"" she said. 
	""It was life changing when I went to South Africa. 
	""Babies should not be born with HIV and we can stop that - we're very close to stopping that. We can't give up, we have to keep going. 
	""I feel so honoured to be here. I feel very humbled."" 
	The Beckhams have been patrons of the Elton John Aids Foundation for more than 20 years."
2014-09-26,FBI: Islamic State's Jihadi John Identified,https://web.archive.org/https://web.archive.org//web/20140926190931/http://news.sky.com/story/1342227/fbi-islamic-states-jihadi-john-identified,"By Sky News US Team FBI Director James Comey says the bureau has identified the Islamic State (IS) militant known as Jihadi John. 
	But Mr Comey told reporters at the agency's headquarters in Washington DC he would not reveal the man's name or nationality. 
	He reportedly said: ""I believe that we have identified him, I'm not going to tell you who I believe it is."" 
	Asked if he would prioritise capturing the killer, he said: ""We will do, and expend the effort that I think the American people would want us to and expect us to."" 
	The UK Home Office said it did not comment on security operations. 
	The jihadist group shocked the world when it released videos of a man with a southern English accent apparently killing two American journalists, James Foley and Steven Sotloff, and a British aid worker, David Haines. 
	In the three clips, the suspect holds a long knife and appears to begin hacking at the captives' necks. He shows only his eyes in all three videos. 
	Mr Haines widow has backed targeted British airstrikes. 
	The British Ambassador to the US, Sir Peter Westmacott, said last month the UK was close to identifying the suspect. 
	Sophisticated technology, including voice-recognition software, was being used to track him down, he added. 
	From the footage, the militant appears to be left-handed and of average height and build. 
	He was said to lead a small group of British jihadis who became known by hostages as The Beatles. 
	The FBI director also said around a dozen Americans are believed to be currently fighting with extremist groups in Syria. 
	He said more than 100 Americans in total had either managed to reach Syria, had been arrested while trying to travel there, or had gone and returned. 
	In his briefing, Mr Comey said a shadowy al Qaeda cell in Syria known as the Khorasan Group may still be plotting attacks on the West. 
	He said there was no sign yet that US airstrikes this week, which American officials believe killed Khorasan's leader, had disrupted the group's plans. 
	It comes as the US continued to carry out airstrikes on targets in Syria - and after officials dismissed reports that IS was planning to attack US and French subway systems."
2014-09-26,Friday's National Newspaper Front Pages,https://web.archive.org/https://web.archive.org//web/20140926190931/http://news.sky.com/story/1342312/fridays-national-newspaper-front-pages,"THE PAPERS' TOP STORIES 
:: The Guardian 
MPs are poised to vote for a third Iraq campaign. 
:: The Times 
	The Times reports that a daughter of a charity worker beheaded by Islamist militants has implored MPs to vote for strikes on Iraq. 
:: The Sun 
	A majority of Britons want the Prime Minister to order strikes on Iraq AND Syria, according to The Sun's front page. 
:: i 
	Any strikes could start within days, says the i. 
:: Daily Mail 
	The Daily Mail reports that a war against the militant group will last three years. 
:: Metro 
	A terrorist plot to attack underground rail systems in Paris and New York has been uncovered, reports the Metro. 
:: The Independent 
	The Independent's front page ""worst ever"" internet security flaw could affect hundreds of millions of devices. 
:: Daily Star 
	A 25-stone mother is demanding bigger handouts, reports the Daily Star. 
:: Financial Times 
	The Financial Time reports that Europe's banking watchdog is planning to clamp down on allowances that are designed to sidestep bonus caps. 
:: The Daily Telegraph 
	Buy-to-let home owners will have to pass an affordability test under new EU laws, says The Daily Telegraph. 
:: Daily Express 
	A spicy diet can beat dementia. 
:: Daily Mirror 
	A woman has spoken about being a victim of a cannibal fantasist. 
:: Watch the Press Preview on Sky News every evening at 10.30pm and 11.30pm. Friday's reviewers are former Ofcom regulator Stewart Purvis and psychotherapist Lucy Beresford."
