date,program,link,transcript
2014-09-22,Barclays Hit By £38m Fine Over Client Assets,https://web.archive.org/https://web.archive.org//web/20140922194724/http://news.sky.com/story/1340322/barclays-hit-by-38m-fine-over-client-assets,"By Mark Kleinman, City Editor Barclays will be hit by the latest in a string of financial penalties this week when the City regulator hands out a £38m fine for failing to ensure adequate protection for clients' funds. 
	Sky News has learnt that the Financial Conduct Authority (FCA) is to announce as soon as Tuesday that Barclays is to pay the fine - a record for this type of misconduct. 
	The punishment relates to the bank's failure to segregate clients' asset properly and maintain adequate records, the second occasion on which Barclays has been fined for such an offence after a £1.1m penalty three years ago. 
	The FCA is understood to have concluded that a much more severe penalty is necessary in order to serve as a deterrent to other firms which continue to demonstrate inadequate controls over clients' assets. 
	Insiders said on Monday that the regulator's announcement would make clear that losses for Barclays' clients were theoretical rather than actual. 
	The penalty imposed on Barclays is higher than a £33m fine with which JP Morgan was hit in 2010 for similar misconduct. 
	Regulators are determined to ensure that major banks separate clients’ funds from their own because of the complexity of unwinding major lenders in the event of insolvency, a problem highlighted with graphic consequences when Lehman Brothers collapsed in 2008. 
	The latest offences relate to multiple failings in Barclays' investment banking division over a five-year period between 2007 and 2012, prior to the appointment of Antony Jenkins as the bank’s group chief executive. 
	Mr Jenkins has made cleaning up Barclays and reaching settlements over past misconduct a priority for his leadership. 
	Since he took over from Bob Diamond in the aftermath of the bank’s £291m fine for rigging the interbank borrowing rate Libor, Mr Jenkins has reached deals for a range of misconduct. 
	Like other banks, it has set aside billions of pounds to compensate customers who were mis-sold payment protection insurance and interest rate hedging products. 
	Earlier this year, it agreed to pay nearly £30m for misconduct by one employee who attempted to rig the daily gold price-fix in London. 
	The process for setting the benchmark price of that commodity and others is now in the process of being overhauled as part of a global clean-up of financial markets. 
	Mr Jenkins’ strategy to simplify Barclays, which includes shrinking its investment bank by cutting thousands of jobs, is beginning to show signs of paying off. 
	Earlier this month, it announced the appointment of John McFarlane, a heavyweight City figure who chairs Aviva, the insurance group, as its next chairman, which was welcomed by the City. 
	It was unclear on Monday whether Barclays would be able to claw back any payments made to former investment bank executives following the FCA’s latest fine. 
	One source said that the £38m figure included a 30% discount to reflect Barclays’ co-operation with the regulator. 
	Barclays and the FCA declined to comment."
2014-09-22,Immigrant Suspects Got Off Lorry On M25,https://web.archive.org/https://web.archive.org//web/20140922194724/http://news.sky.com/story/1340175/immigrant-suspects-got-off-lorry-on-m25,"A group of suspected illegal immigrants have been detained after they ran from the back of a lorry on to a busy motorway. 
	The 13 men and women, believed to be from Ethiopia, got out of the HGV when it stopped on a hard shoulder in Chertsey, Surrey, during the morning rush hour. 
	Traffic had to be slowed between junctions 12 and 13 of the M25 as officers dealt with the incident. 
	The lorry left the scene before the police arrived, and it remains unclear whether the driver is wanted by the UK Border Agency for questioning. 
	Surrey Police said: ""Thirteen people are in custody on suspicion of immigration offences following an incident on the M25 this morning. 
	""Surrey Police received a number of calls around 8.50am from members of the public reporting that they had seen a large group of people getting out of the back of a lorry, which had stopped on the hard shoulder between junctions 11 (Chertsey) and 12 (the M3). 
	""The lorry drove off prior to officers attending the scene. 
	""However, the 13 people, including men and women, were located walking along the M25 and were arrested on suspicion of immigration offences. 
	""They are currently in custody and the UK Border Agency has been informed."" 
	There has been growing tension over the number of migrants trying to enter the UK via the English Channel, with hundreds of people camping in Calais."
2014-09-22,Dog Owner's Arm Nearly Ripped Off In Attack,https://web.archive.org/https://web.archive.org//web/20140922194724/http://news.sky.com/story/1340136/dog-owners-arm-nearly-ripped-off-in-attack,"A dog owner has almost had his arm ripped off after being mauled by two of his American Bulldogs, according to locals. 
	The 47-year-old man screamed for help as bystanders sought to stop the ferocious attack by hitting the dogs with golf clubs and garden tools. 
	Two drivers even tried ramming the dogs in their cars as the animals gripped the victim's head in their mouths, dragging him along the ground. 
	One witness told news agency PA his arm was severed, while another said it was ""almost ripped off"". 
	When the pets eventually ran off, people in High Pittington, County Durham, were left in fear until one dog was shot dead by police and the other was captured. 
	The search operation involved the force helicopter and armed officers. 
	An ambulance crew took the owner to the Royal Victoria Infirmary, Newcastle, where he was receiving treatment for his serious but non-life threatening injuries. 
	The victim, believed to be a local bulldog breeder, was out walking the dogs when the attack took place at around 9.10pm on Sunday night. He has regularly been seen in the area walking up to seven bulldogs. 
	Witness Alison Metcalf said she heard shouting outside her home at around 9pm. 
	""I thought I heard somebody shout 'help me' but I couldn't be certain, then I heard my husband come flying in, he threw our own dog through the front door, and said 'there's a man on the ground',"" she said. 
	""The dogs were just ripping him to bits and dragging him around. 
	""Luckily he's a big guy but if it had been child or someone of a smaller build, it's likely they would not have survived the attack."" 
	She said she had heard fireworks before the attack and thought the dogs could have been ""spooked"". 
	Another witness said: ""I've never seen something so vicious and brutal in my life. 
	""People were behind the dogs in a car beeping the horn constantly to try and scare the dogs away, while some other people were also hitting the dogs with garden tools and golf clubs, but no matter what the dogs would not stop. 
	""Eventually the dogs stopped and ran away, and while they were running one of them was hit by a car, several times I think, but it still continued to run away. 
	""Both dogs ended up missing and then that is when an ambulance and a police car arrived at the scene. 
	""Not too long after more police cars arrived and also a helicopter."" 
	Durham Police said one bulldog was ""humanely destroyed"" in the Coronation Terrace area ""a short time after"". 
	The dog that was caught will be kept in kennels while a decision is made about its future. 
	Durham City Neighbourhood Inspector Dave Coxon said: ""I can confirm that both dogs were quickly captured by police and it was necessary for reasons of public safety to humanely destroy one of the dogs. 
	""I understand this must have been a shocking incident for those witnessing it and I would like to thank those members of the public for their efforts in trying to assist the man."" 
	Police are offering counselling to witnesses of the attack. 
	Anyone with information can contact police on 101."
2014-09-22,Hundreds Face DNA Tests In Beach Murder Probe,https://web.archive.org/https://web.archive.org//web/20140922194724/http://news.sky.com/story/1340131/hundreds-face-dna-tests-in-beach-murder-probe,"Thai police are to take DNA from all the men on Koh Tao island - potentially hundreds of people - in their investigation into the murders of two Britons. 
	The bodies of Hannah Witheridge, 23, and David Miller, 24, were found on a beach on September 15. 
	Police have been criticised over the investigation and are now expanding testing, with some 150 officers drafted in to the popular holiday island, which has 1,300 residents. 
	""We will submit one set of DNA samples and wait for their results before collecting another set of samples,"" said Colonel Uakrissadathikarn in The Phuket Gazette. 
	""We will do this until we find the culprits."" 
	Police are also trying to trace fishing boat workers who may been on the island on the day of the killings. 
	Officers previously said ""sexual jealousy"" may have been the motive and revealed DNA taken from Ms Witheridge's body was from two Asian men. 
	Claims the pair may have argued with a Thai man in a local bar are also being investigated. 
	Police Colonel Kissana Phathanacharoen said: ""We have discovered fresh evidence which could lead to a new suspect who may have had a relationship or one-night stand with Hannah or one of her friends or David the night before they were killed. 
	""We have asked the Metropolitan Police to go back and make enquiries of Hannah's friends on this matter."" 
	Ms Witheridge, from Great Yarmouth, suffered severe head wounds and Mr Miller, from Jersey, died from blows to the head and drowning, post-mortem examinations showed. 
	A garden hoe with Ms Witheridge's blood on it was discovered nearby, and investigators are searching for a blunt metal object used on Mr Miller. 
	Ms Witheridge's family said they had now brought their ""beautiful Hannah"" back to the UK. 
	A £4,000 police reward is on offer for information, and shocked island residents have also raised several thousand pounds on top of that."
2014-09-22,PM Holds Talks On English Votes For English Law,https://web.archive.org/https://web.archive.org//web/20140922194724/http://news.sky.com/story/1339905/pm-holds-talks-on-english-votes-for-english-law,"David Cameron has discussed plans to restrict the voting rights of Scottish MPs in the House of Commons. 
	The Prime Minister intends to address the issue of MPs in Scotland being able to vote on policies that affect only England alongside the granting of fresh powers to Holyrood following the Scottish referendum. 
	Mr Cameron discussed the matter with senior Tory MPs at Chequers. 
	One of those MPs, Leader of the House of Commons William Hague, has been asked to head up a Cabinet committee on the issue. 
	He told Sky News: ""This meeting is the beginning of a process of discussion and consultation - it's not to finalise anything. But there was a great deal of common ground and unity among the Conservative MPs. 
	""Everyone was very clear that the commitments made to Scotland must be honoured, and there's also a good understanding that there are natural consequences for the rest of the UK - it's a matter of fairness to all the people of the United Kingdom. 
	""That's why we're saying in the Conservative Party that decisions that only affect England, or England and Wales, should only be made by MPs who represent those parts of the UK."" 
	Mr Hague's committee will include coalition colleagues from the Liberal Democrats - and he opened the possibility of talks with Labour. 
	The row over Mr Cameron's decision to link the issues threatens to overshadow the Labour Party conference, with Ed Miliband under pressure to support the changes. 
	The Labour leader said he backed greater ""scrutiny"" of the issue, but he stopped short of a pledge on votes, arguing such a major constitutional change should not be rushed. 
	Labour, which has 40 of Scotland's 59 MPs, has most to lose from any measures which would restrict the voting rights of MPs representing constituencies north of the border. 
	Speaking to Sky News at the Labour Party conference in Manchester, shadow chancellor Ed Balls said: ""We need, after Scotland, to make sure we have constitutional change which is fair ... but you don't do that on some rushed timetable decided by politicians."" 
	He added: ""We can have fairness and keep our Union. David Cameron giving the impression somehow this is dead easy, he is just trying to fool people and he won't get away with it."" 
	Labour's proposal would see a UK-wide consultation before a constitution was drawn up for MPs to vote on in autumn 2015. 
	Before the referendum, together with Deputy Prime Minister Nick Clegg, the Tory and Labour leaders signed a vow to Scottish voters promising further powers if they rejected independence. 
	But within hours of Scotland voting No to devolution, Mr Cameron had announced that the process for looking at the question about voting rights of MPs would proceed in tandem with the deal for Scotland. 
	A No 10 source stressed the two processes would run in parallel, but the package for Holyrood was not conditional on reaching agreement at Westminster about English votes. 
	The Prime Minister's ""English votes for English laws"" summit at Chequers has been seen as an attempt to head off a potential backbench rebellion on constitutional reform amid concern about the promises made to Scotland. 
	First Minister Alex Salmond claimed the Westminster party leaders tricked people into voting No to independence with their last-minute promise of more powers for Holyrood. 
	He told Sky News: ""It's the people who voted No because they believed these commitments from the Westminster leadership, these are the people who are feeling most angry, most hurt, most disappointed in Scotland today."""
2014-09-22,Why Ed Miliband Must Give Speech Of His Life,https://web.archive.org/https://web.archive.org//web/20140922194724/http://news.sky.com/story/1340081/why-ed-miliband-must-give-speech-of-his-life,"By Faisal Islam, Political Editor It is entirely understandable that the fallout from the Scottish referendum casts a shadow over this Labour conference. 
	Alex Salmond may be exiting stage left from Bute House and allegedly from frontline politics, but he leaves the entire United Kingdom in an uncertain and febrile state - what I call ""devolution revolution"". 
	For Ed Miliband and his aides: fury at what they call the Prime Minister's ""dawn raid"" on the constitution as the ink was barely dry on the referendum ballot papers. 
	It was a ""political scam"" they say, having agreed earlier in the week that the famous ""vow"" was an unconditional and solemn promise to the Scottish people. 
	Of course it is perfectly reasonable that the PM would consider it impossible to offer further powers to Scotland without considering a broader settlement for the whole of the UK, including England. 
	But Mr Miliband has his own issues. Some of his backbenchers are unhappy with the lack of ""English votes for English laws"" too. And they warn him, that he stands no chance of becoming prime minister without the Labour Party being seen as a party of England. 
The PM will host a fascinating meeting at Chequers of what you might call the Devosceptics. John Redwood, Bernard Jenkins, alongside Dominic Grieve and Rory Stewart are on the guest list. The aim: to hose down some of the anger at the PM's signature on ""the vow"" to Scotland. 
	But here is the issue for the PM. Of course he has his own party political problem at the Conservative/UKIP border of his party. There could be further Carswells on this issue. But is it really a vote winner? Is there a groundswell of concern across the country that Scotland is getting too much? 
	Perhaps on public spending and the maintenance of the Barnett formula. But I suspect that the vow on Barnett has considerable wriggle room as regards the burden of funding higher Scottish spending levels falling on Scottish taxes. 
	In Manchester, Ed Miliband says he has learnt a different lesson from ""the 45"" (% vote for Scottish independence). It reflects a generalised lack of faith in what I call ""the Circle Line bubble"" - Westminster, the media and the City - from across the whole of the United Kingdom. 
	Labour has already announced plans, based on Lord Adonis' ideas for £30bn of devolution of spending to city regions, starting with here, in greater Manchester. 
	If the Conservatives obsess with constitutional reform and the rights of one type of MP over another in the coming weeks and months, then Labour is perfectly happy to focus on living standards and the NHS. 
	If the Conservatives continue to bang the drum about how great the economy is, Labour's private polling is that it continues to entrench the Conservatives as ""out of touch"" with the reality of modern Britain for ordinary voters. 
	There was very little comeback from the Conservatives about Ed Miliband's pay rise - a minimum wage of £8 by 2020. Labour has noticed that George Osborne has been claiming the recovery for a year now. The macroeconomic numbers have gone his way. But Labour retains a poll lead. 
	Now Mr Miliband must make a step up, and give the speech of his life. He has to persuade half the country that he can be a Prime Minister. 
	Yet the Labour city of Glasgow just voted for independence. The distraction of Scotland makes that harder. But we are in for another epic few days in British politics."
2014-09-22,Alan Henning Colleague Appeals For Release,https://web.archive.org/https://web.archive.org//web/20140922194724/http://news.sky.com/story/1339864/alan-henning-colleague-appeals-for-release,"A friend and colleague of British hostage Alan Henning has appealed for Islamic State militants to release the former taxi driver. 
	Dr Shaleema Islam-Zulfiqar travelled to Syria with Mr Henning in December last year as part of a convoy delivering aid to Syrian citizens. 
	Speaking to Sky News, she made a direct plead for the 47-year-old's release: ""Please let him go and release him back to us - to his family and his friends."" 
	Mr Henning had volunteered to drive an ambulance full of medical supplies as part of the charity trip, which was organised by the Bolton and the UK Arab Society. 
	The group planned to transport life-saving medical equipment to a hospital in Idlib, in northwestern Syria. 
	It is believed Mr Henning was abducted in al Dana, a town 24 miles from Aleppo, by IS shortly after arriving in the country. 
	Dr Shaleema Islam-Zulfiqar she feels UK authorities ""haven't been there to support"" members of the charity group affected by the kidnapping. 
	""It's noted that the Government really haven't been there to support us,"" she said. 
	""There was nothing from the UK authorities to support the fact that we had a team member that had been taken (and) detained. 
	""We didn't know where he was and we didn't know what had happened to him. 
	""Now, I appreciate that there are sensitivities around the issue and the government has to be seen to be doing something behind the scenes. 
	""But we had nothing, no idea what had happened to Alan until that video aired last Saturday evening."" 
	Her comments followed a renewed plea from Mr Henning's wife Barbara. 
	In a statement released through the Foreign Office she described her husband as a ""peaceful, selfless"" man. 
	""Alan is a peaceful, selfless man who left his family and his job as a taxi driver in the UK to drive in a convoy all the way to Syria with his Muslim colleagues and friends to help those most in need,"" she said. 
	""When he was taken he was driving an ambulance full of food and water to be handed out to anyone in need. 
	""His purpose for being there was no more and no less. This was an act of sheer compassion. 
	""I cannot see how it could assist any state's cause to allow the world to see a man like Alan dying. 
	""I have been trying to communicate with the Islamic State and the people holding Alan. I have sent some really important messages but they have not been responded to. 
	""I pray that the people holding Alan respond to my messages and contact me before it is too late. 
	""When they hear this message I implore the people of Islamic State to see it in their hearts to release my husband Alan Henning."""
2014-09-22,Eight Headaches For Supermarket Giant Tesco,https://web.archive.org/https://web.archive.org//web/20140922194724/http://news.sky.com/story/1340172/eight-headaches-for-supermarket-giant-tesco,"A decade ago Tesco was an investor's delight, with a share price shooting up more than 70% between 2004 and 2007, and healthy dividend payments. So what went wrong? 
PROFIT WARNINGS 
	With 14 years as CEO to his credit, Sir Terry Leahy stepped down in 2011 after overseeing a leap in pre-tax profit from £750m in 1997 to £3.4bn in 2010. Yet less than a year into the job as new CEO, Philip Clarke issued the first profit warning in two decades as a result of a poor 2011 Christmas trading period. 
CHANGING TASTES 
	Tesco was being squeezed by changing consumer tastes, a dislike of its cavernous and cold stores, and complaints about frosty customer service. It unveiled a £1bn revamp plan in April 2012. 
AMERICAN ADVENTURE 
	In April 2013 it reported its first fall in annual profit for 19 years, with a post-tax profit plunging 95% to £120m, after suffering a £1.2bn charge to exit its struggling Fresh & Easy American venture. 
PROPERTY BUST 
	It also suffered a write-down of £804m for land bought at the height of the property boom, earmarked for development but subsequently put on hold. 
MEAT SCANDAL 
	Last year, Tesco was caught up in the biggest food fraud of the century - with some of its beef burgers found to contain up to 29% horsemeat. 
CLEVER COMPETITION 
	German discounters continue to nibble away at Tesco's customer base at one end, while M&S and Waitrose take share from consumers willing to pay more for premium products. 
BIG NOT NIMBLE 
	Despite the woes Tesco remains the country's biggest retailer and still dwarfs its competition. Tesco is around the same size as Sainsbury's and Morrisons combined, and globally employs more than half a million people in 12 countries. But big rarely means nimble. A large number of senior staff have quit the company in recent years and 40-year Tesco veteran Mr Clarke was ousted by the board last July, after dismissing critics of his turnaround plans. 
SIDELINES 
	Tesco wholly-owns a retail research company named dunnhumby, with offshoots including BzzAgent, KSS Retail, and Sociomantic - which sells display adverts on Facebook and mobiles. 
	This analysis arm crunches data from over 350 million consumers in 28 countries and sells it to corporate giants such as Coca-Cola, Shell and Procter & Gamble. The Tesco empire is huge, with numerous and competing divisions, and as a result does not always see the wood for the trees. 
	Dunnhumby does not trumpet the Tesco parentage on its website - but maybe it is time Tesco starts looking in-house for an answer to its woes."
2014-09-22,Teen Is 13th To Drown Off Mauritius This Year,https://web.archive.org/https://web.archive.org//web/20140922194724/http://news.sky.com/story/1340013/teen-is-13th-to-drown-off-mauritius-this-year,"A teenager died while swimming with dolphins after being best man at his father's wedding on an island paradise. 
	Callum Howkins, 17, from Hinckley in Leicestershire, failed to surface during a dive at Tamarin Bay, Mauritius. 
	His body was found an hour later by the coastguard. 
	The tragedy happened on August 29 following his father's marriage at the La Pirogue Hotel, a luxury four-star resort on the Indian Ocean island. 
	Callum had tweeted earlier: ""Sitting on the beach, drinking from coconuts, watching the women’s water aerobics. Could life get any better?"" 
	Police say the skipper of the dive boat had been arrested, but insist Callum had not been dragged down by the dolphins. 
	His death brings to 13 the number of people to have lost their lives in the area's waters so far this year. 
	Police spokesman Darmarajen Mooroogan told the Mirror: ""Callum was on an excursion off the coast of Tamarin Bay when he drowned while swimming. 
	""A skipper of the boat that conveyed him has been arrested. A preliminary charge of involuntary homicide by imprudence was lodged against him before a court of law. He did appear in court and was released on bail. 
	""The investigation is at a very early stage and we are not yet prepared to discuss details of the accident."" 
	His mum, Louise, told the Leicester Mercury: ""I can't put into words how amazing he was. 
	""He was beautiful inside and out. 
	""He used to say to me, 'Mum, I'm 99.9% perfect', and I always said, 'No, you’re 100% perfect'."" 
	The teenager, who worked part time in a pub, had been about to start an engineering apprenticeship with Caterpillar after completing his first year of A-Levels at John Cleveland College in Hinckley, where staff and students have created a book of remembrance for him. 
	Callum's dad, Gavin, said: ""Nobody ever had a bad word to say about Callum. 
	""He was a real gentleman and treated everyone with so much respect. 
	""He touched everybody’s lives. 
	""He loved everybody and everybody loved him. 
	""He will always be my boy."" 
	A spokesman for John Cleveland College said: ""Callum was a considerate, thoughtful young man with an infectious smile and an ability to bring people together. 
	""His humour and openness meant he was widely known, respected and liked by students and by staff."" 
	An inquest is to be be held into the circumstances of his death."
